ein,plan_name,fund_type,num_participants,num_managers,total_fees,top_manager_concentration,fee_percentile,total_shared_managers,betweenness_score,community_concentration,same_parent_fee_ratio,in_circular_pattern,risk_score,has_manager_data,label
471032262,"DMM3 ENTERPRISES, INC. 401(K) PLAN",Multi Employer,1.0,0.0,0.0,0.0,0.5,0.0,0.0,1.0,0.0,0,0,0,-1
205339117,LAMAR COMPANIES LLC WRAP PLAN,Multi Employer,404.0,0.0,0.0,0.0,0.5,0.0,0.0,1.0,0.0,0,0,0,-1
200492522,ORION ASSOCIATES INC.,Multi Employer,100.0,0.0,0.0,0.0,0.5,0.0,0.0,1.0,0.0,0,0,0,-1
710564091,ROBERT V GRAYBILL DDS KEOGH PLAN,Multi Employer,0.0,0.0,0.0,0.0,0.5,0.0,0.0,1.0,0.0,0,0,0,-1
208610553,"GRADUATION ALLIANCE, INC. HEALTH & WELFARE BENEFIT PLAN",Multi Employer,267.0,0.0,0.0,0.0,0.5,0.0,0.0,1.0,0.0,0,0,0,-1
332390495,FIRMAN BOUNCY CORPORATION PROFIT SHARING PLAN,Multi Employer,0.0,0.0,0.0,0.0,0.5,0.0,0.0,1.0,0.0,0,0,0,-1
271744351,KEZ ENTERPRISES RETIREMENT PLAN,Multi Employer,1.0,0.0,0.0,0.0,0.5,0.0,0.0,1.0,0.0,0,0,0,-1
208106896,"PHUC VINH NGUYEN, M.D., INC. PROFIT SHARING PLAN AND TRUST",Multi Employer,6.0,0.0,0.0,0.0,0.5,0.0,0.0,1.0,0.0,0,0,0,-1
131893923,AMERICAN NURSES ASSOCIATION RETIREMENT PLAN,Multi Employer,0.0,1.0,4400.0,1.0,0.20722891566265061,111.0,0.0,1.0,0.0,0,5,1,0
873618738,"HANCY DANCE STUDIO, INC. RETIREMENT PLAN",Multi Employer,6.0,0.0,0.0,0.0,0.5,0.0,0.0,1.0,0.0,0,0,0,-1
993544951,DBW DESIGN SOLUTIONS INC. RETIREMENT PLAN,Multi Employer,3.0,0.0,0.0,0.0,0.5,0.0,0.0,1.0,0.0,0,0,0,-1
476461822,PROVUSPLOSKIY20T25,Unknown,6.0,1.0,1200.0,1.0,0.12289156626506025,0.0,0.0,1.0,0.0,0,4,1,0
202014853,"TENERA ENVIRONMENTAL, INC. 401(K) SAVINGS PLAN",Multi Employer,14.0,0.0,0.0,0.0,0.5,0.0,0.0,1.0,0.0,0,0,0,-1
823058687,"TADALYSSA, INC. RETIREMENT PLAN",Multi Employer,2.0,0.0,0.0,0.0,0.5,0.0,0.0,1.0,0.0,0,0,0,-1
510145980,UTAH SYMPHONY & OPERA WELFARE BENEFIT PLAN,Multi Employer,155.0,0.0,0.0,0.0,0.5,0.0,0.0,1.0,0.0,0,0,0,-1
821784223,JHRA INC. RETIREMENT PLAN,Multi Employer,2.0,0.0,0.0,0.0,0.5,0.0,0.0,1.0,0.0,0,0,0,-1
43259154,NATIONAL CABLE COMMUNICATIONS FLEXIBLE BENEFIT PLAN,Multi Employer,155.0,0.0,0.0,0.0,0.5,0.0,0.0,1.0,0.0,0,0,0,-1
882514931,DW NATIONAL SALES AND MARKETING GROUP INC. RETIREMENT PLAN,Multi Employer,3.0,0.0,0.0,0.0,0.5,0.0,0.0,1.0,0.0,0,0,0,-1
810231786,FRANCES MAHON DEACONESS HOSPITAL V. ADD PLAN,Multi Employer,106.0,0.0,0.0,0.0,0.5,0.0,0.0,1.0,0.0,0,0,0,-1
46622861,BRANDYWINE GROUP TRUST,DFE,,1.0,54553.0,1.0,0.7204819277108434,0.0,0.0,1.0,0.0,0,4,1,0
660942829,ANGGLOJR30 RETIRMENT PLAN (ALSO KNOWN AS ANGGLOJR RETIREMENT PLAN),Multi Employer,1.0,0.0,0.0,0.0,0.5,0.0,0.0,1.0,0.0,0,0,0,-1
666037000,M. VELAZQUEZ RETIREMENT PLAN,Multi Employer,1.0,0.0,0.0,0.0,0.5,0.0,0.0,1.0,0.0,0,0,0,-1
831234995,"CAA KICK, INC. 401(K) PLAN",Multi Employer,0.0,0.0,0.0,0.0,0.5,0.0,0.0,1.0,0.0,0,0,0,-1
922274069,"EAR NOSE & THROAT SPECIALISTS OF ILLINOIS, LTD. PROFIT SHARING PLAN",Multi Employer,0.0,0.0,0.0,0.0,0.5,0.0,0.0,1.0,0.0,0,0,0,-1
475026397,"MCCLURE ENTERPRISES, INC. 401(K) PROFIT SHARING PLAN",Multi Employer,0.0,0.0,0.0,0.0,0.5,0.0,0.0,1.0,0.0,0,0,0,-1
351106685,"ZURCHER TIRE, INC. LONG TERM DISABILITY MASTER PLAN",Multi Employer,368.0,0.0,0.0,0.0,0.5,0.0,0.0,1.0,0.0,0,0,0,-1
351782349,MONTICELLO ANIMAL HOSPITAL 401K PLAN,Multi Employer,1.0,0.0,0.0,0.0,0.5,0.0,0.0,1.0,0.0,0,0,0,-1
870652539,NORTH EASTERN SERVICES EMPLOYEE BENEFIT PLAN,Multi Employer,258.0,0.0,0.0,0.0,0.5,0.0,0.0,1.0,0.0,0,0,0,-1
883219138,"SHAMROCK SIGN SOLUTIONS, INC. RETIREMENT PLAN",Multi Employer,3.0,0.0,0.0,0.0,0.5,0.0,0.0,1.0,0.0,0,0,0,-1
473372642,"ZEELAND FREIGHT SERVICES, LLC PROFIT SHARING 401(K",Multi Employer,152.0,1.0,105494.0,1.0,0.8530120481927711,1111111111.0,0.0,1.0,0.0,0,5,1,0
831136380,"FUNDAMENTAL HOLDINGS, INC. 401K PROFIT SHARING PLAN",Multi Employer,6.0,0.0,0.0,0.0,0.5,0.0,0.0,1.0,0.0,0,0,0,-1
472128647,THE NUDYNE GROUP HEALTH AND WELFARE PLAN,Multi Employer,137.0,0.0,0.0,0.0,0.5,0.0,0.0,1.0,0.0,0,0,0,-1
462859321,"DENISTON IT SOLUTIONS, INC. RETIREMENT PLAN",Multi Employer,4.0,0.0,0.0,0.0,0.5,0.0,0.0,1.0,0.0,0,0,0,-1
660617712,MLO RETIREMENT PLAN (ALSO KNOW AS DRA. MARIA DEL L. ORTIZ RETIREMENT PLAN),Multi Employer,1.0,0.0,0.0,0.0,0.5,0.0,0.0,1.0,0.0,0,0,0,-1
881883173,"JEIS AUTO, INC. 401(K) PLAN",Multi Employer,4.0,0.0,0.0,0.0,0.5,0.0,0.0,1.0,0.0,0,0,0,-1
660552123,DIANA P. MARTINEZ RETIREMENT PLAN,Multi Employer,1.0,0.0,0.0,0.0,0.5,0.0,0.0,1.0,0.0,0,0,0,-1
570525930,"ATTORNEYS LEE, EADON, ISGETT, POPWELL AND OWENS, PA PROFIT SHARING PLAN",Multi Employer,0.0,0.0,0.0,0.0,0.5,0.0,0.0,1.0,0.0,0,0,0,-1
873221110,MKK SERVICES INC. RETIREMENT PLAN,Multi Employer,3.0,0.0,0.0,0.0,0.5,0.0,0.0,1.0,0.0,0,0,0,-1
464907386,PROSPECT CAPITAL RESTAURANTS LLC 401(K) RETIREMENT SAVINGS PLAN,Multi Employer,349.0,1.0,1738.0,1.0,0.15180722891566265,111.0,0.0,1.0,1.0,0,7,1,0
455549326,E AND R ENTERPRISE RETIREMENT PLAN,Multi Employer,2.0,0.0,0.0,0.0,0.5,0.0,0.0,1.0,0.0,0,0,0,-1
391234372,VSP VISION PLAN,Multi Employer,0.0,0.0,0.0,0.0,0.5,0.0,0.0,1.0,0.0,0,0,0,-1
393897412,KATHY & CASSIE ENTERPRISE INC. RETIREMENT PLAN,Multi Employer,2.0,0.0,0.0,0.0,0.5,0.0,0.0,1.0,0.0,0,0,0,-1
992703370,BRISAY HOME LOANS LLC SOLO 401K,Multi Employer,1.0,0.0,0.0,0.0,0.5,0.0,0.0,1.0,0.0,0,0,0,-1
391043814,"IMAGE STUDIOS, INC. 401(K) PROFIT SHARING PLAN",Multi Employer,0.0,0.0,0.0,0.0,0.5,0.0,0.0,1.0,0.0,0,0,0,-1
821863034,"ANDI ENTERPRISES, INC. 401(K) PLAN",Multi Employer,4.0,0.0,0.0,0.0,0.5,0.0,0.0,1.0,0.0,0,0,0,-1
610441433,AHEAD HUMAN RESOURCES CAFETERIA PLAN,Multi Employer,200.0,0.0,0.0,0.0,0.5,0.0,0.0,1.0,0.0,0,0,0,-1
660591175,"DR. JORGE O. TORRES GUZMAN, SPECIALIST IN PEDIATRIC DENTISTRY, PSC RETIREMENT PLAN",Multi Employer,1.0,0.0,0.0,0.0,0.5,0.0,0.0,1.0,0.0,0,0,0,-1
452651103,"DUPUY CONSTRUCTION SERVICES, INC. RETIREMENT PLAN",Multi Employer,1.0,0.0,0.0,0.0,0.5,0.0,0.0,1.0,0.0,0,0,0,-1
862165539,YOROI PROPERTIES INC 401(K) PLAN,Multi Employer,1.0,0.0,0.0,0.0,0.5,0.0,0.0,1.0,0.0,0,0,0,-1
146075575,THE MOHAWK FINE PAPERS INC. DEFINED CONTRIBUTIONS SAVINGS PLAN,Multi Employer,0.0,3.0,40513.0,0.7651864833510231,0.6457831325301204,2122222111.0,0.0,1.0,0.0,0,4,1,0
954457550,EMBLEM ENTERPRISES INC PROFIT SHARING PLAN,Multi Employer,0.0,0.0,0.0,0.0,0.5,0.0,0.0,1.0,0.0,0,0,0,-1
237289763,SERVICES TO ENHANCE POTENTIAL HEALTH BENEFITS PLAN,Multi Employer,113.0,0.0,0.0,0.0,0.5,0.0,0.0,1.0,0.0,0,0,0,-1
666047549,J. ARIAS COLON RETIREMENT PLAN,Multi Employer,1.0,0.0,0.0,0.0,0.5,0.0,0.0,1.0,0.0,0,0,0,-1
232721546,"ALLIED MORTGAGE GROUP, INC MEDICAL PLAN",Multi Employer,108.0,0.0,0.0,0.0,0.5,0.0,0.0,1.0,0.0,0,0,0,-1
541124387,"KALFUS & NACHMAN, P.C. 401(K) PROFIT SHARING PLAN",Multi Employer,66.0,0.0,0.0,0.0,0.5,0.0,0.0,1.0,0.0,0,0,0,-1
471386440,"ARCOLA SERVICES GROUP, INC. 401(K) PLAN",Multi Employer,8.0,0.0,0.0,0.0,0.5,0.0,0.0,1.0,0.0,0,0,0,-1
334778065,ABANA COACHING ALLIANCE CORP. RETIREMENT PLAN,Multi Employer,1.0,0.0,0.0,0.0,0.5,0.0,0.0,1.0,0.0,0,0,0,-1
421528382,"NEUDESIC, LLC WELFARE BENEFITS PLAN",Multi Employer,0.0,0.0,0.0,0.0,0.5,0.0,0.0,1.0,0.0,0,0,0,-1
921294195,GT1 ENTERPRISES CORP. 401(K) PLAN,Multi Employer,0.0,0.0,0.0,0.0,0.5,0.0,0.0,1.0,0.0,0,0,0,-1
461063055,MOJAVE RESOURCES CORPORATION 401(K) PLAN,Multi Employer,1.0,0.0,0.0,0.0,0.5,0.0,0.0,1.0,0.0,0,0,0,-1
331353288,"NOCOGO COMMERCIAL PAINTING, INC. RETIREMENT PLAN",Multi Employer,2.0,0.0,0.0,0.0,0.5,0.0,0.0,1.0,0.0,0,0,0,-1
462764116,"TIGER TALENT, INC. 401(K) PLAN AND TRUST",Multi Employer,3.0,0.0,0.0,0.0,0.5,0.0,0.0,1.0,0.0,0,0,0,-1
391271042,"HELGESEN INDUSTRIES, INC. WELFARE BENEFIT PLAN",Multi Employer,0.0,0.0,0.0,0.0,0.5,0.0,0.0,1.0,0.0,0,0,0,-1
840919515,"DICK & JANE, INC. PROFIT SHARING PLAN & TRUST",Multi Employer,3.0,0.0,0.0,0.0,0.5,0.0,0.0,1.0,0.0,0,0,0,-1
202619619,"ARKA PROPERTIES GROUP, INC. FLEX PLAN",Multi Employer,6.0,0.0,0.0,0.0,0.5,0.0,0.0,1.0,0.0,0,0,0,-1
132679049,"PEDIGREE SKI SHOP, INC. RETIREMENT TRUST",DFE,,0.0,0.0,0.0,0.5,0.0,0.0,1.0,0.0,0,0,0,-1
820407405,"G.J. VERTI-LINE PUMPS, INC. 401(K) PROFIT SHARING PLAN",Multiple Employer,16.0,0.0,0.0,0.0,0.5,0.0,0.0,1.0,0.0,0,0,0,-1
843338922,"WESTERN STATES OPTICAL, INC. 401(K) PROFIT SHARING PLAN",Multi Employer,0.0,0.0,0.0,0.0,0.5,0.0,0.0,1.0,0.0,0,0,0,-1
900537250,"BR ENTERPRISES, INC. 401K PROFIT SHARING PLAN",Multi Employer,0.0,0.0,0.0,0.0,0.5,0.0,0.0,1.0,0.0,0,0,0,-1
273959113,PROBT1,Multi Employer,6.0,0.0,0.0,0.0,0.5,0.0,0.0,1.0,0.0,0,0,0,-1
814682860,"SWINGLER, INC. RETIREMENT PLAN",Multi Employer,1.0,0.0,0.0,0.0,0.5,0.0,0.0,1.0,0.0,0,0,0,-1
474749384,"CONFLUENT HOLDINGS, LLC GROUP INSURANCE PLAN",Multi Employer,797.0,4.0,487124.0,0.5324537489427743,0.9686746987951808,1.1211111111111114e+41,50.0,0.5,0.4220239610448263,0,2,1,1
583439885,ARIALE RETIREMENT PLAN,Multi Employer,1.0,0.0,0.0,0.0,0.5,0.0,0.0,1.0,0.0,0,0,0,-1
843743712,HOWARD FORCE OF KENTUCKYANA INC. RETIREMENT PLAN,Multi Employer,3.0,0.0,0.0,0.0,0.5,0.0,0.0,1.0,0.0,0,0,0,-1
462401934,MOORE ESTATE VINEYARDS INC. RETIREMENT PLAN,Multi Employer,2.0,0.0,0.0,0.0,0.5,0.0,0.0,1.0,0.0,0,0,0,-1
954238177,DIG CORPORATION 401(K) PROFIT SHARING PLAN,Multi Employer,,0.0,0.0,0.0,0.5,0.0,0.0,1.0,0.0,0,0,0,-1
660365386,"SAN PABLO PATHOLOGY GROUP, INC. RETIREMENT PLAN SERIES 94-999",Multi Employer,16.0,0.0,0.0,0.0,0.5,0.0,0.0,1.0,0.0,0,0,0,-1
922203383,"ALCASI, CORP. RETIREMENT PLAN",Multi Employer,2.0,0.0,0.0,0.0,0.5,0.0,0.0,1.0,0.0,0,0,0,-1
271430044,"MIRRORED STORAGE, INC 401(K) PLAN",Multi Employer,2.0,0.0,0.0,0.0,0.5,0.0,0.0,1.0,0.0,0,0,0,-1
860490804,COMPRESSED AIR POWER EMPLOYEE STOCK OWNERSHIP PLAN,Multi Employer,0.0,0.0,0.0,0.0,0.5,0.0,0.0,1.0,0.0,0,0,0,-1
470376529,THE OMAHA HOME FOR BOYS PENSION PLAN,Multi Employer,0.0,0.0,0.0,0.0,0.5,0.0,0.0,1.0,0.0,0,0,0,-1
931888495,BKAS VENTURES RETIREMENT PLAN,Multi Employer,5.0,0.0,0.0,0.0,0.5,0.0,0.0,1.0,0.0,0,0,0,-1
200899894,"PACHALAD, INC. PROFIT SHARING PLAN",Multi Employer,5.0,0.0,0.0,0.0,0.5,0.0,0.0,1.0,0.0,0,0,0,-1
550805988,AXOGEN CORPORATION HEALTH AND WELFARE PLAN,Multi Employer,607.0,0.0,0.0,0.0,0.5,0.0,0.0,1.0,0.0,0,0,0,-1
300231161,PJB FOOD CORP DBA KEY FOOD SUPERMARKET HEALTH & WELFARE BENEFIT PLAN,Multi Employer,218.0,0.0,0.0,0.0,0.5,0.0,0.0,1.0,0.0,0,0,0,-1
800503722,"INDUSTRIAL DIELECTRICS, INC. DBA COMPOSITES INTERNATIONAL, INC. EMPLOYEE HEALTH PLAN",Multi Employer,142.0,0.0,0.0,0.0,0.5,0.0,0.0,1.0,0.0,0,0,0,-1
112575784,"BOON EDAM, INC. WELFARE BENEFIT PLAN",Multi Employer,226.0,0.0,0.0,0.0,0.5,0.0,0.0,1.0,0.0,0,0,0,-1
631039279,"WATER WAY DISTRIBUTING CO, INC 401(K) PLAN",Multi Employer,21.0,0.0,0.0,0.0,0.5,0.0,0.0,1.0,0.0,0,0,0,-1
383488315,HARRIS STEEL PROFIT SHARING PLAN,Multi Employer,9.0,0.0,0.0,0.0,0.5,0.0,0.0,1.0,0.0,0,0,0,-1
860263471,COPPER STATE BOLT AND NUT CO. EMPLOYEE BENEFIT PLAN,Multi Employer,610.0,0.0,0.0,0.0,0.5,0.0,0.0,1.0,0.0,0,0,0,-1
440563337,INTER-STATE STUDIO & PUBLISHING CO. EMPLOYEE BENEFITS PLAN,Multi Employer,358.0,0.0,0.0,0.0,0.5,0.0,0.0,1.0,0.0,0,0,0,-1
994595819,KOOKA CO. RETIREMENT PLAN,Multi Employer,1.0,0.0,0.0,0.0,0.5,0.0,0.0,1.0,0.0,0,0,0,-1
871832766,KIRBY BUSINESS MANAGEMENT INC. RETIREMENT PLAN,Multi Employer,1.0,0.0,0.0,0.0,0.5,0.0,0.0,1.0,0.0,0,0,0,-1
751481788,"METROPLEX WELDING SUPPLY, INC. PROFIT SHARING PLAN",Multi Employer,38.0,0.0,0.0,0.0,0.5,0.0,0.0,1.0,0.0,0,0,0,-1
232259884,VERIZON INCOME SECURITY PLAN FOR MID-ATLANTIC ASSOCIATES,Multi Employer,8905.0,0.0,0.0,0.0,0.5,0.0,0.0,1.0,0.0,0,0,0,-1
201292646,CHS GROUP EMPLOYEE HEALTH PLAN,Multi Employer,181.0,3.0,92188.0,0.4309671540764525,0.8192771084337349,0.0,0.0,1.0,0.0,0,1,1,1
630461038,"WILSON LUMBER COMPANY, INC. EMPLOYEE BENEFITS PLAN",Multi Employer,215.0,0.0,0.0,0.0,0.5,0.0,0.0,1.0,0.0,0,0,0,-1
598019528,DIAZ SOTOMAYOR & PEREZ CANDAL RETIREMENT PLAN (ALSO KNOWN AS F. DIAZ SOTOMAYOR RETIREMENT PLAN),Multi Employer,2.0,0.0,0.0,0.0,0.5,0.0,0.0,1.0,0.0,0,0,0,-1
232063262,"YORK ROOFING, INC. EMPLOYEE BENEFIT PLAN",Multi Employer,13.0,2.0,20314.0,0.7820222506645663,0.4530120481927711,1.1121111111111111e+39,0.0,1.0,0.7820222506645663,0,7,1,0
232565019,WILKIE LEXUS LIFE AND AD&D PLAN,Multi Employer,149.0,0.0,0.0,0.0,0.5,0.0,0.0,1.0,0.0,0,0,0,-1
943383193,"AUTOMATED SERVICES AND PRODUCTS, INC. PROFIT SHARING PLAN",Multi Employer,9.0,0.0,0.0,0.0,0.5,0.0,0.0,1.0,0.0,0,0,0,-1
461290547,"MATH CHAMPIONS OF BOYNTON BEACH, INC. 401(K) PLAN",Multi Employer,5.0,0.0,0.0,0.0,0.5,0.0,0.0,1.0,0.0,0,0,0,-1
834671945,"FIRESIDE HOLDINGS, INC. RETIREMENT PLAN",Multi Employer,5.0,0.0,0.0,0.0,0.5,0.0,0.0,1.0,0.0,0,0,0,-1
208185749,"LUCELA, INC. I401K PLAN",Multi Employer,2.0,0.0,0.0,0.0,0.5,0.0,0.0,1.0,0.0,0,0,0,-1
334918456,"CVBLEGACY GROUP, INC. 401K PROFIT SHARING PLAN",Multi Employer,1.0,0.0,0.0,0.0,0.5,0.0,0.0,1.0,0.0,0,0,0,-1
598127345,HEMM RETIREMENT PLAN,Multi Employer,1.0,0.0,0.0,0.0,0.5,0.0,0.0,1.0,0.0,0,0,0,-1
440185897,TEAMSTERS LOCAL UNION NO. 541 THRIFT PLAN AND TRUST,Multi Employer,4.0,0.0,0.0,0.0,0.5,0.0,0.0,1.0,0.0,0,0,0,-1
391257432,"NERCON ENG. & MFG., INC. FLEXIBLE BENEFITS PLAN",Multi Employer,115.0,0.0,0.0,0.0,0.5,0.0,0.0,1.0,0.0,0,0,0,-1
821095331,"SAPAR ENT, INC. 401(K) PLAN",Multi Employer,1.0,0.0,0.0,0.0,0.5,0.0,0.0,1.0,0.0,0,0,0,-1
364407380,"WARRIOR INVICTUS HOLDING COMPANY, INC. WELFARE BENEFIT PLAN",Multi Employer,532.0,0.0,0.0,0.0,0.5,0.0,0.0,1.0,0.0,0,0,0,-1
822771411,"DD 29 ENTERPRISES, INC. 401(K) PLAN",Multi Employer,1.0,0.0,0.0,0.0,0.5,0.0,0.0,1.0,0.0,0,0,0,-1
823050051,JET LLC 401(K) PROFIT SHARING PLAN & TRUST,Multi Employer,0.0,1.0,505.0,1.0,0.08674698795180723,1111.0,0.0,1.0,0.0,0,5,1,0
260332652,RIVERSIDE MANUFACTURING LLC WEEKLY ACCIDENT & ILLNESS INCOME BENEFIT PLAN,Multi Employer,150.0,0.0,0.0,0.0,0.5,0.0,0.0,1.0,0.0,0,0,0,-1
455615245,THE MULLIGAN GROUP RETIREMENT PLAN,Multi Employer,0.0,0.0,0.0,0.0,0.5,0.0,0.0,1.0,0.0,0,0,0,-1
943339062,HEALTHYPETS INC 401(K) PROFIT SHARING PLAN & TRUST,Multi Employer,82.0,2.0,43302.0,0.6474989607870306,0.6674698795180722,111111111.0,0.0,1.0,0.3525010392129694,0,3,1,1
630110181,PINNACLE BANK PROFIT SHARING RETIREMENT PLAN,Multi Employer,51.0,0.0,0.0,0.0,0.5,0.0,0.0,1.0,0.0,0,0,0,-1
591819759,O. NIEBLA DIAZ RETIREMENT PLAN (FORMERLY OSVALDO I NIEBLA DIAZ RETIREMENT PLAN),Multi Employer,1.0,0.0,0.0,0.0,0.5,0.0,0.0,1.0,0.0,0,0,0,-1
394563105,BATT CLEANING MANAGEMENT INC. RETIREMENT PLAN,Multi Employer,1.0,0.0,0.0,0.0,0.5,0.0,0.0,1.0,0.0,0,0,0,-1
50268246,PILGRIM SCREW CORPORATION EMPLOYEE SAVINGS PLAN,Multi Employer,79.0,0.0,0.0,0.0,0.5,0.0,0.0,1.0,0.0,0,0,0,-1
871508840,REBSOM VENTURES RETIREMENT PLAN,Multi Employer,1.0,0.0,0.0,0.0,0.5,0.0,0.0,1.0,0.0,0,0,0,-1
473355525,"CORE & MORE, INC. 401(K) PLAN",Multi Employer,4.0,0.0,0.0,0.0,0.5,0.0,0.0,1.0,0.0,0,0,0,-1
954320789,"MICHAEL J. SARLO, A SOLE PROPRIETOR 401K) PROFIT SHARING PLAN",Multi Employer,6.0,0.0,0.0,0.0,0.5,0.0,0.0,1.0,0.0,0,0,0,-1
273868708,"LAVENDER RETIREMENT, INC. PROFIT SHARING PLAN",Multi Employer,0.0,0.0,0.0,0.0,0.5,0.0,0.0,1.0,0.0,0,0,0,-1
830857952,JAXSON MAXIMUS INC RETIREMENT PLAN,Multi Employer,0.0,0.0,0.0,0.0,0.5,0.0,0.0,1.0,0.0,0,0,0,-1
680092300,HALSEY GROCERY 401(K) PLAN,Multi Employer,0.0,0.0,0.0,0.0,0.5,0.0,0.0,1.0,0.0,0,0,0,-1
923046645,"AC CONCEPTS SERVICES, LLC 401(K) PROFIT SHARING PLAN",Multi Employer,0.0,3.0,0.0,0.0,0.02530120481927711,2.221111121121122e+44,61.171400600223855,1.0,0.0,0,2,1,1
751095067,AMERICAN BANK OF COMMERCE 401(K) PROFIT SHARING PLAN,Multi Employer,0.0,0.0,0.0,0.0,0.5,0.0,0.0,1.0,0.0,0,0,0,-1
660346487,MGI RETIREMENT & SAVINGS PLAN,Multi Employer,290.0,0.0,0.0,0.0,0.5,0.0,0.0,1.0,0.0,0,0,0,-1
560633683,WIKOFF COLOR CORPORATION WELFARE BENEFIT PLAN,Multi Employer,426.0,0.0,0.0,0.0,0.5,0.0,0.0,1.0,0.0,0,0,0,-1
521811971,JOHNS HOPKINS HOME CARE GROUP 403(B) PLAN,Multiple Employer,1399.0,4.0,134980.0,0.7719291746925471,0.8891566265060241,21212432111.0,125.0,1.0,0.2280708253074529,0,4,1,0
521341890,"THE JOHNS HOPKINS BAYVIEW MEDICAL CENTER, INC. REPRESENTED EMPLOYEES 403(B) PLAN",Multi Employer,490.0,3.0,23496.0,0.5243871297242084,0.4843373493975904,2212332111.0,0.0,1.0,0.4756128702757916,0,2,1,1
912112788,"KIM E. LARSON, D.D.S., PLLC 401(K) PLAN",Multi Employer,0.0,0.0,0.0,0.0,0.5,0.0,0.0,1.0,0.0,0,0,0,-1
923540586,TRISTARZ GROWTH INC. RETIREMENT PLAN,Multi Employer,6.0,0.0,0.0,0.0,0.5,0.0,0.0,1.0,0.0,0,0,0,-1
332995699,THE SALT COLLECTIVE INC. 401(K) PLAN,Multi Employer,0.0,0.0,0.0,0.0,0.5,0.0,0.0,1.0,0.0,0,0,0,-1
412663080,"TOP PRO TEAM, INC. RETIREMENT PLAN",Multi Employer,1.0,0.0,0.0,0.0,0.5,0.0,0.0,1.0,0.0,0,0,0,-1
208694999,"ENVOY ENTERPRISES, INC. PROFIT SHARING PLAN & TRUST",Multi Employer,0.0,0.0,0.0,0.0,0.5,0.0,0.0,1.0,0.0,0,0,0,-1
581495126,"GRIST OIL COMPANY, INC PROFIT SHARING PLAN",Multi Employer,9.0,0.0,0.0,0.0,0.5,0.0,0.0,1.0,0.0,0,0,0,-1
931731983,TEN28 INC 401(K) PLAN,Multi Employer,2.0,0.0,0.0,0.0,0.5,0.0,0.0,1.0,0.0,0,0,0,-1
862258871,WEST SHORE MARKETING INC. 401(K) PLAN,Multi Employer,1.0,0.0,0.0,0.0,0.5,0.0,0.0,1.0,0.0,0,0,0,-1
931933888,MICHAEL T INC. RETIREMENT PLAN,Multi Employer,1.0,0.0,0.0,0.0,0.5,0.0,0.0,1.0,0.0,0,0,0,-1
991783090,"TINY HBM ENTERPRISES, INC. RETIREMENT PLAN",Multi Employer,2.0,0.0,0.0,0.0,0.5,0.0,0.0,1.0,0.0,0,0,0,-1
863134776,MDB HOLDINGS INC. RETIREMENT PLAN,Multi Employer,1.0,0.0,0.0,0.0,0.5,0.0,0.0,1.0,0.0,0,0,0,-1
993199852,LEADERSHIP SUCCESS INC. RETIREMENT PLAN,Multi Employer,2.0,0.0,0.0,0.0,0.5,0.0,0.0,1.0,0.0,0,0,0,-1
300855844,"TIL GAMING, LLC WRAP BENEFIT PLAN",Multi Employer,183.0,0.0,0.0,0.0,0.5,0.0,0.0,1.0,0.0,0,0,0,-1
812629853,SDB 401(K) PLAN.,Multi Employer,8.0,0.0,0.0,0.0,0.5,0.0,0.0,1.0,0.0,0,0,0,-1
630696876,THREE NOTCH GROUP INC. HEALTH & WELFARE PLAN,Multi Employer,171.0,1.0,10701.0,1.0,0.3469879518072289,1.0,0.0,1.0,1.0,0,6,1,0
621580428,"CITCO COMMUNITY BANCSHARES, INC. EMPLOYEE BENEFIT PLAN",Multi Employer,183.0,0.0,0.0,0.0,0.5,0.0,0.0,1.0,0.0,0,0,0,-1
870428943,"MOXTEK, INC. CAFETERIA PLAN",Multi Employer,2000.0,0.0,0.0,0.0,0.5,0.0,0.0,1.0,0.0,0,0,0,-1
473653952,"DUNAMIS, INC. RETIREMENT PLAN",Multi Employer,0.0,0.0,0.0,0.0,0.5,0.0,0.0,1.0,0.0,0,0,0,-1
42986322,DENNISON LUBRICANTS HEALTH AND WELFARE PLAN,Multi Employer,132.0,0.0,0.0,0.0,0.5,0.0,0.0,1.0,0.0,0,0,0,-1
934017845,RESPERMITS INC. RETIREMENT PLAN,Multi Employer,2.0,0.0,0.0,0.0,0.5,0.0,0.0,1.0,0.0,0,0,0,-1
666046562,LJ MONGIL CASASNOVAS RETIREMENT PLAN,Multi Employer,1.0,0.0,0.0,0.0,0.5,0.0,0.0,1.0,0.0,0,0,0,-1
660776959,CRITICAL SLEEP & PULMONARY SOLUTIONS RETIREMENT PLAN,Multi Employer,1.0,0.0,0.0,0.0,0.5,0.0,0.0,1.0,0.0,0,0,0,-1
630763585,STRONG AIR CONDITIONING 401(K) RETIREMENT PLAN,Multi Employer,5.0,0.0,0.0,0.0,0.5,0.0,0.0,1.0,0.0,0,0,0,-1
521604268,ATLAS CONTAINER CORPORATION WELFARE PLAN,Multi Employer,183.0,0.0,0.0,0.0,0.5,0.0,0.0,1.0,0.0,0,0,0,-1
362379423,"VW BROACHING SERVICE, INC. EMPLOYEES' PROFIT SHARING/401(K) PLAN & TRUST",Multi Employer,0.0,0.0,0.0,0.0,0.5,0.0,0.0,1.0,0.0,0,0,0,-1
844999826,APT ORBIT INC. RETIREMENT PLAN,Multi Employer,1.0,0.0,0.0,0.0,0.5,0.0,0.0,1.0,0.0,0,0,0,-1
474454378,POET HOLDING COMPANY GROUP HEALTH PLAN,Multi Employer,2054.0,0.0,0.0,0.0,0.5,0.0,0.0,1.0,0.0,0,0,0,-1
812174460,OATS OVERNIGHT EMPLOYEE BENEFIT PLAN,Multi Employer,453.0,0.0,0.0,0.0,0.5,0.0,0.0,1.0,0.0,0,0,0,-1
61759685,"WORKSPACE PLUS, INC. HEALTH AND WELFARE PLAN",Multi Employer,550.0,0.0,0.0,0.0,0.5,0.0,0.0,1.0,0.0,0,0,0,-1
542002267,MCMANIS & MONSALVE ASSOCIATES PROFIT SHARING PLAN,Multi Employer,0.0,2.0,67603.0,0.8150969631525228,0.7662650602409639,0.0,0.0,1.0,0.8150969631525228,0,6,1,0
260874838,"AZALEA HEALTH INNOVATIONS, INC. HEALTH & WELFARE BENEFITS PLAN",Multi Employer,260.0,0.0,0.0,0.0,0.5,0.0,0.0,1.0,0.0,0,0,0,-1
203999663,"2056 COMPANY, INC. PROFIT SHARING PLAN",Multi Employer,4.0,0.0,0.0,0.0,0.5,0.0,0.0,1.0,0.0,0,0,0,-1
660832889,UNIPRO RETIREMENT PLAN,Multi Employer,28.0,0.0,0.0,0.0,0.5,0.0,0.0,1.0,0.0,0,0,0,-1
461257779,FORESIGHT BANK EMPLOYEE STOCK OWNERSHIP PLAN,Multi Employer,37.0,0.0,0.0,0.0,0.5,0.0,0.0,1.0,0.0,0,0,0,-1
300284495,M & J ENGINEERING 401(K) PLAN,Multi Employer,243.0,4.0,56479.0,0.7643371872731458,0.7253012048192771,1.1211111211211112e+43,125.00000000000004,0.5,0.6936385413894064,0,5,1,0
43360865,DEW CONSTRUCTION HEALTH AND WELFARE PLAN,Multi Employer,112.0,0.0,0.0,0.0,0.5,0.0,0.0,1.0,0.0,0,0,0,-1
311581466,"REVLOCAL, LLC PROFIT SHARING &",Multi Employer,0.0,2.0,39414.0,0.5658141777033542,0.6385542168674698,1.1111111111111113e+23,0.0,1.0,0.4341858222966459,0,3,1,1
620509807,"THE BAILEY COMPANY, INC. GROUP HEALTH BENEFIT PLAN",Multi Employer,255.0,0.0,0.0,0.0,0.5,0.0,0.0,1.0,0.0,0,0,0,-1
841186219,MEAGHER OIL & GAS PROPERTIES PROFIT SHARING PLAN AND TRUST,Multi Employer,6.0,0.0,0.0,0.0,0.5,0.0,0.0,1.0,0.0,0,0,0,-1
272037969,PLANMEMBER POOLED EMPLOYER PLAN,Multiple Employer,0.0,1.0,17574.0,1.0,0.44096385542168676,0.0,0.0,1.0,0.0,0,4,1,0
411704817,"PAL MANAGEMENT, INC. EMPLOYEE BENEFIT PLAN",Multi Employer,163.0,0.0,0.0,0.0,0.5,0.0,0.0,1.0,0.0,0,0,0,-1
271560715,INVESTAR HOLDING CORPORATION SEVERANCE PAYMENT PLAN,Multi Employer,317.0,0.0,0.0,0.0,0.5,0.0,0.0,1.0,0.0,0,0,0,-1
452664830,SYFAN LOGISTICS WELFARE BENEFIT PLAN,Multi Employer,310.0,0.0,0.0,0.0,0.5,0.0,0.0,1.0,0.0,0,0,0,-1
204218604,POET EMPLOYEE GROUP HEALTH BENEFIT PLAN,Multi Employer,2403.0,0.0,0.0,0.0,0.5,0.0,0.0,1.0,0.0,0,0,0,-1
932255289,"POINTER SOLUTIONS, INC. 401K PROFIT SHARING PLAN",Multi Employer,2.0,0.0,0.0,0.0,0.5,0.0,0.0,1.0,0.0,0,0,0,-1
871230522,LAURIE BOSCH INC. RETIREMENT PLAN,Multi Employer,1.0,0.0,0.0,0.0,0.5,0.0,0.0,1.0,0.0,0,0,0,-1
880660334,"SWIPE RIGHT PROPERTY MANAGEMENT, INC. RETIREMENT PLAN",Multi Employer,0.0,0.0,0.0,0.0,0.5,0.0,0.0,1.0,0.0,0,0,0,-1
820341648,JOHNSON RESTAURANT GROUP SELF FUNDED MEDICAL REIMBURSEMENT PLAN,Multi Employer,31.0,0.0,0.0,0.0,0.5,0.0,0.0,1.0,0.0,0,0,0,-1
611151139,KATAYAMA AMERICAN CO INC EMPLOYEE BENEFITS PLAN,Multi Employer,348.0,0.0,0.0,0.0,0.5,0.0,0.0,1.0,0.0,0,0,0,-1
392289056,"BERRY BUSINESS GROUP, INC. 401K PROFIT SHARING PLAN",Multi Employer,1.0,0.0,0.0,0.0,0.5,0.0,0.0,1.0,0.0,0,0,0,-1
330567081,WEISS FAMILY LIMITED PARTNERSHIP PROFIT SHARING 401(K) PLAN,Multi Employer,4.0,0.0,0.0,0.0,0.5,0.0,0.0,1.0,0.0,0,0,0,-1
824956327,HANNAH HDA CORP 401(K) PLAN,Multi Employer,1.0,0.0,0.0,0.0,0.5,0.0,0.0,1.0,0.0,0,0,0,-1
843857620,HUGHES AUTOMOTIVE CENTER INC. RETIREMENT PLAN,Multi Employer,4.0,0.0,0.0,0.0,0.5,0.0,0.0,1.0,0.0,0,0,0,-1
432114621,THE PIEDMONT BANK SECTION 401(K) PROFIT SHARING PLAN,Multi Employer,0.0,2.0,107384.0,0.9249795127765775,0.8602409638554217,111.0,0.0,1.0,0.0750204872234224,0,5,1,0
823779175,"I3 BROADBAND, LLC",Multi Employer,183.0,0.0,0.0,0.0,0.5,0.0,0.0,1.0,0.0,0,0,0,-1
222212361,"TECHNI-FORMS, INC. 401(K) PROFIT SHARING PLAN",Multi Employer,0.0,0.0,0.0,0.0,0.5,0.0,0.0,1.0,0.0,0,0,0,-1
364749833,"ALLPAK CONTAINER, LLC RETIREMENT SAVINGS PLAN",Multi Employer,0.0,0.0,0.0,0.0,0.5,0.0,0.0,1.0,0.0,0,0,0,-1
202583973,INVESCO GLOBAL INFRASTRUCTURE TRUST,DFE,,0.0,0.0,0.0,0.5,0.0,0.0,1.0,0.0,0,0,0,-1
760475815,NOV INC. 401(K) PLAN FOR EXTRACT EMPLOYEES,Multi Employer,0.0,1.0,1276.0,1.0,0.12771084337349398,1.1111111111111113e+42,0.0,1.0,0.0,0,5,1,0
874788381,"JD VOSS ENTERPRISES, INC. 401(K) PLAN",Multi Employer,0.0,0.0,0.0,0.0,0.5,0.0,0.0,1.0,0.0,0,0,0,-1
834293830,"FIGHT 612, INC. 401(K) PLAN",Multi Employer,0.0,0.0,0.0,0.0,0.5,0.0,0.0,1.0,0.0,0,0,0,-1
853562061,BENSON TS RETIREMENT PLAN,Multi Employer,0.0,0.0,0.0,0.0,0.5,0.0,0.0,1.0,0.0,0,0,0,-1
520591656,DISTRICT 1199SEIU - THE JOHNS HOPKINS HOSPITAL 403(B) PLAN,Multi Employer,1905.0,2.0,57860.0,1.0,0.7349397590361446,2212222111.0,0.0,1.0,0.0,0,5,1,0
521250028,JOHNS HOPKINS MEDICAL MANAGEMENT CORPORATION 401(K) PLAN,Multi Employer,1040.0,4.0,21057.0,0.5325070047965047,0.4650602409638554,21212342111.0,125.0,1.0,0.5502683193237403,0,4,1,0
273841167,RELADYNE LLC MEDICAL,Multi Employer,0.0,0.0,0.0,0.0,0.5,0.0,0.0,1.0,0.0,0,0,0,-1
561155595,BLUM INC EMPLOYEE FLEXIBLE SPENDING ACCT PLAN,Multi Employer,130.0,0.0,0.0,0.0,0.5,0.0,0.0,1.0,0.0,0,0,0,-1
991603871,"FAIRFIELD LONGEVITY 2, INC. RETIREMENT PLAN",Multi Employer,1.0,0.0,0.0,0.0,0.5,0.0,0.0,1.0,0.0,0,0,0,-1
274820465,"HIGH GATE, INC. 401(K) PLAN",Multi Employer,2.0,0.0,0.0,0.0,0.5,0.0,0.0,1.0,0.0,0,0,0,-1
680125601,"TERRA, INC. 401(K) PLAN",Multi Employer,6.0,0.0,0.0,0.0,0.5,0.0,0.0,1.0,0.0,0,0,0,-1
731064338,COUNSELING & RECOVERY SERVICES OF OKLAHOMA HEALTH AND WELFARE PLAN,Multi Employer,110.0,0.0,0.0,0.0,0.5,0.0,0.0,1.0,0.0,0,0,0,-1
333355232,"MAIZE & BLUE SERVICES, INC. RETIREMENT PLAN",Multi Employer,1.0,0.0,0.0,0.0,0.5,0.0,0.0,1.0,0.0,0,0,0,-1
932623201,"KZ COLLECTIVE, INC. PROFIT SHARING PLAN",Multi Employer,0.0,0.0,0.0,0.0,0.5,0.0,0.0,1.0,0.0,0,0,0,-1
561268414,"BEVERLY KNITS, INC. FLEXIBLE BENEFIT PLAN 125 CAFETERIA & HEALTH PLAN",Multi Employer,90.0,2.0,65258.0,0.548070734622575,0.7566265060240964,0.0,0.0,1.0,0.0,0,2,1,1
161529616,DAVID J WEGMAN 401(K) PLAN,Multi Employer,0.0,1.0,46596.0,1.0,0.689156626506024,0.0,0.0,1.0,0.0,0,4,1,0
863701650,"JK ALLISON ENTERPRISES, INC. 401K PROFIT SHARING PLAN",Multi Employer,5.0,0.0,0.0,0.0,0.5,0.0,0.0,1.0,0.0,0,0,0,-1
132624395,"PLEASANTVILLE HOLDING COMPANY, INC. PROFIT SHARING PLAN",Multi Employer,,0.0,0.0,0.0,0.5,0.0,0.0,1.0,0.0,0,0,0,-1
992870865,"KULASZEWSKI ENTERPRISES, INC. 401K PROFIT SHARING PLAN",Multi Employer,2.0,0.0,0.0,0.0,0.5,0.0,0.0,1.0,0.0,0,0,0,-1
470899588,ALLEGIANCE HEALTH MANAGEMENT RETIREMENT SAVINGS PLAN,Multi Employer,3001.0,1.0,29052.0,1.0,0.5614457831325301,111.0,0.0,1.0,1.0,0,7,1,0
870575504,"PRIORITY ONE SECURITY, INC. HEALTH PLAN",Multi Employer,55.0,1.0,49539.0,1.0,0.7036144578313253,1.1111111111111112e+39,0.0,1.0,1.0,0,7,1,0
261960246,MCLEAN BENEFIT PLAN,Multi Employer,181.0,0.0,0.0,0.0,0.5,0.0,0.0,1.0,0.0,0,0,0,-1
383930020,"MC HOLDINGS, INC. RETIREMENT PLAN",Multi Employer,3.0,0.0,0.0,0.0,0.5,0.0,0.0,1.0,0.0,0,0,0,-1
660697819,"KM DENTAL, CSP RETIREMENT PLAN",Multi Employer,1.0,0.0,0.0,0.0,0.5,0.0,0.0,1.0,0.0,0,0,0,-1
