ein,plan_name,fund_type,num_participants,num_managers,total_fees,top_manager_concentration,fee_percentile,total_shared_managers,betweenness_score,community_concentration,same_parent_fee_ratio,in_circular_pattern,risk_score,has_manager_data,label
863926079,SOCKETS AND STARS INC. RETIREMENT PLAN,Multi Employer,0.0,0.0,0.0,0.0,0.5,0.0,0.0,1.0,0.0,0,0,0,-1
611145339,"THE SECTION 403(B) PLAN FOR HOSPICE OF HOPE, INC.",Multi Employer,120.0,3.0,13613.0,1.0,0.39036144578313253,1.1211111211211212e+44,674.343045209085,0.5,0.0,0,3,1,1
465381514,"FUNBOX, INC. 401(K) PLAN",Multi Employer,0.0,0.0,0.0,0.0,0.5,0.0,0.0,1.0,0.0,0,0,0,-1
205802701,"MASTER SECURITY COMPANY, LLC RETIREMENT PLAN",Multi Employer,0.0,0.0,0.0,0.0,0.5,0.0,0.0,1.0,0.0,0,0,0,-1
842484794,"SOUTHWEST VACATIONS, INC. RETIREMENT PLAN",Multi Employer,2.0,0.0,0.0,0.0,0.5,0.0,0.0,1.0,0.0,0,0,0,-1
273128403,"PARKE FAMILY SENIOR CARE, INC. 401(K) PLAN",Multi Employer,0.0,0.0,0.0,0.0,0.5,0.0,0.0,1.0,0.0,0,0,0,-1
452444674,"PREMIER BUSINESS MANAGEMENT GROUP, INC. 401(K) PROFIT SHARING PLAN",Multi Employer,1.0,0.0,0.0,0.0,0.5,0.0,0.0,1.0,0.0,0,0,0,-1
742474669,JAMES T PARMA PC 401K PROFIT SHARING PLAN,Multi Employer,3.0,0.0,0.0,0.0,0.5,0.0,0.0,1.0,0.0,0,0,0,-1
872832465,"GOAT RODEO NUNNERY & GUN SHOW, INC. RETIREMENT PLAN",Multi Employer,2.0,0.0,0.0,0.0,0.5,0.0,0.0,1.0,0.0,0,0,0,-1
132849236,ALBERT A ATTIA MD PC PROFIT SHARING PLAN,Multi Employer,0.0,0.0,0.0,0.0,0.5,0.0,0.0,1.0,0.0,0,0,0,-1
410883453,FAMILY SERVICE ROCHESTER,Multi Employer,139.0,0.0,0.0,0.0,0.5,0.0,0.0,1.0,0.0,0,0,0,-1
833654095,RUFF & TUMBLE CORP. 401(K) PLAN,Multi Employer,8.0,0.0,0.0,0.0,0.5,0.0,0.0,1.0,0.0,0,0,0,-1
751732923,"HENSLEY INDUSTRIES, INC. BENEFIT PLANS",Multi Employer,382.0,0.0,0.0,0.0,0.5,0.0,0.0,1.0,0.0,0,0,0,-1
822394528,"COMMINGLED PENSION TRUST FUND (GLOBAL SELECT EQUITY) OF JPMORGAN CHASE BANK, N.A.",DFE,,0.0,0.0,0.0,0.5,0.0,0.0,1.0,0.0,0,0,0,-1
751719718,HEAD & NECK SURGICAL ASSOCIATES 401(K) PLAN,Multi Employer,0.0,0.0,0.0,0.0,0.5,0.0,0.0,1.0,0.0,0,0,0,-1
660239950,PUERTO RICO FEDERAL CREDIT UNION 1081.01 RETIREMENT PLAN,Multi Employer,25.0,0.0,0.0,0.0,0.5,0.0,0.0,1.0,0.0,0,0,0,-1
822967774,CARIUM 401(K) PLAN,Multi Employer,0.0,0.0,0.0,0.0,0.5,0.0,0.0,1.0,0.0,0,0,0,-1
911387558,WALKER'S RENTON SUBARU-MAZDA 401(K) PLAN,Multi Employer,132.0,0.0,0.0,0.0,0.5,0.0,0.0,1.0,0.0,0,0,0,-1
541108079,DEPAUL COMMUNITY RESOURCES 403B PLAN,Multi Employer,0.0,3.0,25283.0,0.9776529683977376,0.5108433734939759,11111111111.0,0.0,0.3333333333333333,0.997033579875806,0,5,1,0
452945909,BLUE GHOST INC. 401K PROFIT SHARING PLAN,Multi Employer,4.0,0.0,0.0,0.0,0.5,0.0,0.0,1.0,0.0,0,0,0,-1
931374359,WHITE BAY CAPITAL INC. 401(K) PLAN,Multi Employer,2.0,0.0,0.0,0.0,0.5,0.0,0.0,1.0,0.0,0,0,0,-1
821787113,"SAM LEE ENTERPRISES, INC. 401K PROFIT SHARING PLAN",Multi Employer,0.0,0.0,0.0,0.0,0.5,0.0,0.0,1.0,0.0,0,0,0,-1
332254144,BHAVEN SENIOR CARE INC. RETIREMENT PLAN,Multi Employer,1.0,0.0,0.0,0.0,0.5,0.0,0.0,1.0,0.0,0,0,0,-1
141881132,ALLIANCE HOSPITALITY EMPLOYEE SAVINGS PLAN,Multi Employer,76.0,3.0,66645.0,1.0,0.7614457831325301,1.1111112112112112e+42,0.0,0.5,0.0,0,3,1,1
660717319,"JAVIER DELGADO CANDELARIO MD, PSC RETIREMENT PLAN",Multi Employer,1.0,0.0,0.0,0.0,0.5,0.0,0.0,1.0,0.0,0,0,0,-1
934508862,AHIW LOGISTICS INC. RETIREMENT PLAN,Multi Employer,0.0,0.0,0.0,0.0,0.5,0.0,0.0,1.0,0.0,0,0,0,-1
383429943,INTEGRATED PACKAGING MACHINERY WELFARE BENEFIT PLAN,Multi Employer,110.0,0.0,0.0,0.0,0.5,0.0,0.0,1.0,0.0,0,0,0,-1
611532475,DECERINA UY MD PC 401(K) PROFIT SHARING PLAN & TRUST,Multi Employer,7.0,0.0,0.0,0.0,0.5,0.0,0.0,1.0,0.0,0,0,0,-1
474313669,"VISIONCOR SOLUTIONS, INC. RETIREMENT PLAN",Multi Employer,3.0,0.0,0.0,0.0,0.5,0.0,0.0,1.0,0.0,0,0,0,-1
832383955,"DALSTON GROUP, INC. 401(K) PLAN",Multi Employer,2.0,0.0,0.0,0.0,0.5,0.0,0.0,1.0,0.0,0,0,0,-1
352562653,ARIZONA MORTGAGE & INVESTMENTS 401(K) PLAN,Multi Employer,3.0,0.0,0.0,0.0,0.5,0.0,0.0,1.0,0.0,0,0,0,-1
843394992,"AMTHERE HOME HEALTH, INC. RETIREMENT PLAN",Multi Employer,0.0,0.0,0.0,0.0,0.5,0.0,0.0,1.0,0.0,0,0,0,-1
854094044,"JSK ENTERPRISES, CO. 401(K) PLAN",Multi Employer,4.0,0.0,0.0,0.0,0.5,0.0,0.0,1.0,0.0,0,0,0,-1
721519467,YELLOWSTONE SURGERY CENTER EMPLOYEE BENEFIT PLAN,Multi Employer,121.0,0.0,0.0,0.0,0.5,0.0,0.0,1.0,0.0,0,0,0,-1
874726467,KSNLT RETIREMENT PLAN,Multi Employer,0.0,0.0,0.0,0.0,0.5,0.0,0.0,1.0,0.0,0,0,0,-1
262196063,"BEACH BUDDY ENTERPRISES, INC. 401(K) PLAN",Multi Employer,0.0,0.0,0.0,0.0,0.5,0.0,0.0,1.0,0.0,0,0,0,-1
813040678,EVENTWORKS 401(K) PLAN,Multi Employer,0.0,1.0,100.0,1.0,0.05783132530120482,1.1111111111111113e+42,0.0,1.0,0.0,0,5,1,0
630797318,"HALE BUILDING COMPANY, INC. PROFIT SHARING PLAN",Multi Employer,28.0,0.0,0.0,0.0,0.5,0.0,0.0,1.0,0.0,0,0,0,-1
814949947,SUNADA FROYO INC. 401(K) PLAN,Multi Employer,1.0,0.0,0.0,0.0,0.5,0.0,0.0,1.0,0.0,0,0,0,-1
833700543,STREIGHT HOLDINGS INC. RETIREMENT PLAN,Multi Employer,0.0,0.0,0.0,0.0,0.5,0.0,0.0,1.0,0.0,0,0,0,-1
570890443,"WILLIAM L. LOWRANCE, M.D. D/B/A FOOTHILLS UROLOGY PROFIT SHARING PLAN & TRUST",Multi Employer,1.0,0.0,0.0,0.0,0.5,0.0,0.0,1.0,0.0,0,0,0,-1
920314605,WESTBERG CORPORATION PROFIT SHARING PLAN,Multi Employer,0.0,0.0,0.0,0.0,0.5,0.0,0.0,1.0,0.0,0,0,0,-1
462631488,"DOVE MANAGEMENT, INC. 401(K) PLAN",Multi Employer,0.0,0.0,0.0,0.0,0.5,0.0,0.0,1.0,0.0,0,0,0,-1
340668850,AMERICAN LAWYERS COMPANY PENSION PLAN AND TRUST,Multi Employer,5.0,0.0,0.0,0.0,0.5,0.0,0.0,1.0,0.0,0,0,0,-1
240795620,SCRANTON COUNSELING CENTER 401(K) PROFIT SHARING PLAN,Multi Employer,124.0,1.0,0.0,0.0,0.02530120481927711,1111111111.0,0.0,1.0,0.0,0,3,1,1
261761853,"CASSADY SCHILLER WEALTH MANAGEMENT, LLC 401(K) PROFIT SHARING PLAN",Multi Employer,0.0,0.0,0.0,0.0,0.5,0.0,0.0,1.0,0.0,0,0,0,-1
731399914,"AMERICAN STAFFCORP, INC MEDICAL PLAN",Multi Employer,166.0,0.0,0.0,0.0,0.5,0.0,0.0,1.0,0.0,0,0,0,-1
911519023,"CASCADE WEST DEVELOPMENT, INC. PROFIT SHARING PLAN",Multi Employer,20.0,0.0,0.0,0.0,0.5,0.0,0.0,1.0,0.0,0,0,0,-1
274149645,"CULMINATION DECADE, INC. PROFIT SHARING PLAN",Multi Employer,0.0,0.0,0.0,0.0,0.5,0.0,0.0,1.0,0.0,0,0,0,-1
462402680,"ARCHROMA U.S., INC. WELFARE BENEFITS PLAN",Multi Employer,182.0,0.0,0.0,0.0,0.5,0.0,0.0,1.0,0.0,0,0,0,-1
834515763,SPANGLER ENTERPRISES INC. RETIREMENT PLAN,Multi Employer,3.0,0.0,0.0,0.0,0.5,0.0,0.0,1.0,0.0,0,0,0,-1
951642394,UNIVERSITY OF SOUTHERN CALIFORNIA POSTDOCTORAL SCHOLAR BENEFIT PROGRAM,Multi Employer,412.0,0.0,0.0,0.0,0.5,0.0,0.0,1.0,0.0,0,0,0,-1
881715103,"BAY STATE SUITES, INC. RETIREMENT PLAN",Multi Employer,2.0,0.0,0.0,0.0,0.5,0.0,0.0,1.0,0.0,0,0,0,-1
751662295,"DALE W. GREER, D.D.S., INC. CROSS TESTED PROFIT SHARING PLAN",Multi Employer,7.0,0.0,0.0,0.0,0.5,0.0,0.0,1.0,0.0,0,0,0,-1
463593159,LONG FAMILY SALONS INC. RETIREMENT PLAN,Multi Employer,2.0,0.0,0.0,0.0,0.5,0.0,0.0,1.0,0.0,0,0,0,-1
993090335,NOEL CDKJ CORPORATION 401(K) PLAN,Multi Employer,1.0,0.0,0.0,0.0,0.5,0.0,0.0,1.0,0.0,0,0,0,-1
911490139,"SORENSEN & EDWARDS, P.S. PROFIT SHARING PLAN & TRUST",Multi Employer,1.0,0.0,0.0,0.0,0.5,0.0,0.0,1.0,0.0,0,0,0,-1
831751684,"FOURSWANS, INC. 401(K) PLAN",Multi Employer,0.0,0.0,0.0,0.0,0.5,0.0,0.0,1.0,0.0,0,0,0,-1
814394629,"AHLUWALIA ENTERPRISES, INC. RETIREMENT PLAN",Multi Employer,3.0,0.0,0.0,0.0,0.5,0.0,0.0,1.0,0.0,0,0,0,-1
611028712,"E.W. JAMES & SONS, INC. EMPLOYEE PROFIT SHARING & STOCK OWNERSHIP PLAN",Multi Employer,0.0,0.0,0.0,0.0,0.5,0.0,0.0,1.0,0.0,0,0,0,-1
834352615,"DRET, INC. 401(K) PLAN",Multi Employer,1.0,0.0,0.0,0.0,0.5,0.0,0.0,1.0,0.0,0,0,0,-1
562401998,MIM SOFTWARE INC. 401(K) PLAN,Multi Employer,0.0,1.0,16670.0,1.0,0.42650602409638555,1.1111111111111113e+42,0.0,1.0,0.0,0,5,1,0
382066104,ORYANA FOOD COOPERATIVE INC. EMPLOYEE BENEFITS PLAN,Multi Employer,141.0,0.0,0.0,0.0,0.5,0.0,0.0,1.0,0.0,0,0,0,-1
660612246,HERIBERTO MATOS RUIZ RETIREMENT PLAN,Multi Employer,1.0,0.0,0.0,0.0,0.5,0.0,0.0,1.0,0.0,0,0,0,-1
480968728,CSB BANCSHARES INC AMENDED EMPLOYEE STOCK OWNERSHIP PLAN,Multi Employer,46.0,0.0,0.0,0.0,0.5,0.0,0.0,1.0,0.0,0,0,0,-1
910384940,"RICHARDS, MERRILL & PETERSON, INC. SAVINGS PLAN",Multi Employer,11.0,0.0,0.0,0.0,0.5,0.0,0.0,1.0,0.0,0,0,0,-1
450217814,STATE BANK OF LAKOTA EMPLOYEES PROFIT SHARING PLAN & TRUST,Multi Employer,9.0,0.0,0.0,0.0,0.5,0.0,0.0,1.0,0.0,0,0,0,-1
883881767,CAMBRO ENDEAVORS INC. RETIREMENT PLAN,Multi Employer,2.0,0.0,0.0,0.0,0.5,0.0,0.0,1.0,0.0,0,0,0,-1
475598535,ALSHAMY INC 401(K) PLAN,Multi Employer,4.0,0.0,0.0,0.0,0.5,0.0,0.0,1.0,0.0,0,0,0,-1
474058225,BNBL FIRM INC. 401(K) PLAN,Multi Employer,3.0,0.0,0.0,0.0,0.5,0.0,0.0,1.0,0.0,0,0,0,-1
200263611,WORKING AMERICA ASSOCIATION EMPLOYEE BENEFIT PLAN,Multi Employer,54.0,0.0,0.0,0.0,0.5,0.0,0.0,1.0,0.0,0,0,0,-1
473174108,"ELIVELIHOOD, INC. 401(K) PLAN",Multi Employer,1.0,0.0,0.0,0.0,0.5,0.0,0.0,1.0,0.0,0,0,0,-1
473108202,"PERGE, INC. RETIREMENT PLAN",Multi Employer,1.0,0.0,0.0,0.0,0.5,0.0,0.0,1.0,0.0,0,0,0,-1
454128796,"M & K SERVICES, INC. RETIREMENT PLAN",Multi Employer,6.0,0.0,0.0,0.0,0.5,0.0,0.0,1.0,0.0,0,0,0,-1
141681699,THE CHAZEN COMPANIES EMPLOYEE STOCK OWNERSHIP PLAN,Multi Employer,0.0,2.0,32716.0,0.6160594204670498,0.6024096385542169,1.0,0.0,1.0,0.0,0,2,1,1
570695149,"BUFORD GOFF & ASSOCIATES, INC. 401(K) PROFIT SHARING PLAN",Multi Employer,22.0,0.0,0.0,0.0,0.5,0.0,0.0,1.0,0.0,0,0,0,-1
825379958,D&A VENTURES RETIREMENT PLAN,Multi Employer,2.0,0.0,0.0,0.0,0.5,0.0,0.0,1.0,0.0,0,0,0,-1
825194836,JPIX INC 401(K) PLAN,Multi Employer,1.0,0.0,0.0,0.0,0.5,0.0,0.0,1.0,0.0,0,0,0,-1
871763225,"HALCO GROUP, INC. 401(K) PROFIT SHARING PLAN",Multi Employer,1.0,0.0,0.0,0.0,0.5,0.0,0.0,1.0,0.0,0,0,0,-1
994484351,TX GARAGE HUB CO. RETIREMENT PLAN,Multi Employer,1.0,0.0,0.0,0.0,0.5,0.0,0.0,1.0,0.0,0,0,0,-1
310998683,"GUILD ASSOCIATES, INC. HEALTH AND WELFARE PLAN",Multi Employer,109.0,0.0,0.0,0.0,0.5,0.0,0.0,1.0,0.0,0,0,0,-1
611860717,"JBL HOLDINGS, INC. RETIREMENT PLAN",Multi Employer,3.0,0.0,0.0,0.0,0.5,0.0,0.0,1.0,0.0,0,0,0,-1
872766285,SAVVY DOLLAR INC. RETIREMENT PLAN,Multi Employer,0.0,0.0,0.0,0.0,0.5,0.0,0.0,1.0,0.0,0,0,0,-1
333546067,MONTROND TELECOM INC. 401(K) PLAN,Multi Employer,0.0,0.0,0.0,0.0,0.5,0.0,0.0,1.0,0.0,0,0,0,-1
261093145,ACADIA BLUE CORPORATION PROFIT SHARING PLAN,Multi Employer,0.0,0.0,0.0,0.0,0.5,0.0,0.0,1.0,0.0,0,0,0,-1
112896310,"ACME INDUSTRIES OF WEST BABYLON, INC. 401(K) PROFIT SHARING PLAN",Multi Employer,4.0,0.0,0.0,0.0,0.5,0.0,0.0,1.0,0.0,0,0,0,-1
352306449,"BRIGHTON-BEST INTERNATIONAL, INC. WELFARE BENEFIT PLAN",Multi Employer,545.0,0.0,0.0,0.0,0.5,0.0,0.0,1.0,0.0,0,0,0,-1
560928892,SOUTHERN FABRICATORS INC. 401(K) PLAN,Multi Employer,123.0,2.0,3000.0,1.0,0.18313253012048192,1111111111.0,0.0,1.0,1.0,0,7,1,0
760723559,HEALTH AND WELFARE 5500,Multi Employer,107.0,0.0,0.0,0.0,0.5,0.0,0.0,1.0,0.0,0,0,0,-1
581260205,"OVERVIEW, INC. (GA) 403 (B) PLAN",Multi Employer,8.0,0.0,0.0,0.0,0.5,0.0,0.0,1.0,0.0,0,0,0,-1
161332576,HERKIMER COUNTY CHAMBER OF COMMERCE DENTAL PLAN,Multiple Employer,3.0,0.0,0.0,0.0,0.5,0.0,0.0,1.0,0.0,0,0,0,-1
666049813,A. ALVARADO-ARCE RETIREMENT PLAN,Multi Employer,1.0,0.0,0.0,0.0,0.5,0.0,0.0,1.0,0.0,0,0,0,-1
598122963,M. UZCATEGUI SANTOS RETIREMENT PLAN,Multi Employer,1.0,0.0,0.0,0.0,0.5,0.0,0.0,1.0,0.0,0,0,0,-1
862525254,OHANA ENTERPRISE INC. RETIREMENT PLAN,Multi Employer,5.0,0.0,0.0,0.0,0.5,0.0,0.0,1.0,0.0,0,0,0,-1
844998359,TRANSFORMATIVE REAL ESTATE 401K TRUST,Multi Employer,1.0,0.0,0.0,0.0,0.5,0.0,0.0,1.0,0.0,0,0,0,-1
300426509,GENRIC INC COMPREHENSIVE EMPLOYEE BENEFIT PLAN,Multi Employer,335.0,0.0,0.0,0.0,0.5,0.0,0.0,1.0,0.0,0,0,0,-1
951644037,"THE CAFETERIA, HEALTH CARE REIMBURSMENT AND DEPENDENT CARE PLANS AND THE PRE-TAX PREMIUM CAFETERIA PLAN OF PEPPERDINE UNIVERSITY",Multi Employer,771.0,0.0,0.0,0.0,0.5,0.0,0.0,1.0,0.0,0,0,0,-1
570425805,"SOUTHERN VACUUM COOLING, INC. PROFIT SHARING PLAN",Multi Employer,3.0,0.0,0.0,0.0,0.5,0.0,0.0,1.0,0.0,0,0,0,-1
825260016,"LUMINA SOLAR, INC. HEALTH & WELFARE PLAN",Multi Employer,118.0,2.0,10703.0,0.5338690086891525,0.3493975903614458,1111121.0,249.0,1.0,1.0,0,5,1,0
160708550,SHORT TERM DISABILITY PLAN FOR EMPLOYEES OF HODGSON RUSS LLP,Multi Employer,,0.0,0.0,0.0,0.5,0.0,0.0,1.0,0.0,0,0,0,-1
598077670,YM RODRIGUEZ VALLE RETIREMENT PLAN,Multi Employer,1.0,0.0,0.0,0.0,0.5,0.0,0.0,1.0,0.0,0,0,0,-1
20559065,"PREFERRED STRATEGIES, INC. EMPLOYEE STOCK OWNERSHIP PLAN",Multi Employer,0.0,0.0,0.0,0.0,0.5,0.0,0.0,1.0,0.0,0,0,0,-1
270926400,"ALLIANCE POLYMERS AND SERVICES, LLC PROFIT SHARING PLAN",Multi Employer,4.0,0.0,0.0,0.0,0.5,0.0,0.0,1.0,0.0,0,0,0,-1
453131005,LOWELL FIVE CENT SAVINGS BANK FLEXIBLE BENEFITS PLAN,Multi Employer,99.0,0.0,0.0,0.0,0.5,0.0,0.0,1.0,0.0,0,0,0,-1
262758353,"PARADISE LANES & FAMILY ENTERTAINMENT CENTER, INC. 401(K) PLAN",Multi Employer,0.0,0.0,0.0,0.0,0.5,0.0,0.0,1.0,0.0,0,0,0,-1
942353518,POLISHING CORPORATION OF AMERICA EMPLOYEE STOCK OWNERSHIP PLAN,Multi Employer,14.0,0.0,0.0,0.0,0.5,0.0,0.0,1.0,0.0,0,0,0,-1
530204701,"GEORGETOWN DAY SCHOOL, INC. 403(B) RETIREMENT PLAN",Multi Employer,0.0,3.0,31157.0,0.792181532239946,0.5831325301204819,1111111111.0,774.7837884337873,1.0,0.2005969766023686,0,4,1,0
137197337,"COMMINGLED PENSION TRUST FUND (INTERNATIONAL RATES) OF JPMORGAN CHASE BANK, N.A.",DFE,,0.0,0.0,0.0,0.5,0.0,0.0,1.0,0.0,0,0,0,-1
201308307,NEENAH SEVERANCE PAY PLAN,Multi Employer,0.0,0.0,0.0,0.0,0.5,0.0,0.0,1.0,0.0,0,0,0,-1
264656792,RESOLVIT RESOURCES LLC 401(K) RETIREMENT PLAN,Multi Employer,0.0,1.0,0.0,0.0,0.02530120481927711,1.1111111111111112e+53,0.0,1.0,0.0,0,3,1,1
561837872,TRITON RESTAURANTS EMPLOYEES PROFIT SHARING PLAN AND TRUST,Multi Employer,0.0,2.0,14275.0,1.0,0.40240963855421685,0.0,0.0,1.0,0.0,0,4,1,0
421321436,"CCB PACKAGING, INC. EMPLOYEE BENEFITS PLAN",Multi Employer,192.0,0.0,0.0,0.0,0.5,0.0,0.0,1.0,0.0,0,0,0,-1
223460933,"MONMOUTH CARDIOLOGY ASSOCIATES, LLC 401(K) PLAN",Multi Employer,139.0,0.0,0.0,0.0,0.5,0.0,0.0,1.0,0.0,0,0,0,-1
881332161,INKTAVO BENEFIT PLAN,Multi Employer,111.0,0.0,0.0,0.0,0.5,0.0,0.0,1.0,0.0,0,0,0,-1
410145155,FIRST NATIONAL BANK OF BEMIDJI EMPLOYEE STOCK OWNERSHIP PLAN AND TRUST,Multi Employer,100.0,0.0,0.0,0.0,0.5,0.0,0.0,1.0,0.0,0,0,0,-1
363167203,HEALTH PROTECTION PLAN FOR EMPLOYEES OF MITEK CORPORATION,Multi Employer,321.0,0.0,0.0,0.0,0.5,0.0,0.0,1.0,0.0,0,0,0,-1
150476885,GPO FEDERAL CREDIT UNION,Multi Employer,107.0,0.0,0.0,0.0,0.5,0.0,0.0,1.0,0.0,0,0,0,-1
844035663,"JLC PRECISION MACHINING, INC. 401(K) PLAN",Multi Employer,7.0,0.0,0.0,0.0,0.5,0.0,0.0,1.0,0.0,0,0,0,-1
852435344,"BREEDER'S CHOICE PET FOODS, LLC FLEXIBLE BENEFIT PLAN",Multi Employer,12.0,0.0,0.0,0.0,0.5,0.0,0.0,1.0,0.0,0,0,0,-1
454598772,"SWG PAINTING, INC. 401K PLAN",Multi Employer,2.0,0.0,0.0,0.0,0.5,0.0,0.0,1.0,0.0,0,0,0,-1
271610722,PURA VIDA HOMES INC. 401(K) PLAN,Multi Employer,1.0,0.0,0.0,0.0,0.5,0.0,0.0,1.0,0.0,0,0,0,-1
205331223,"GATEWAY ENGINEERING, INC. 401(K) PLAN",Multi Employer,16.0,0.0,0.0,0.0,0.5,0.0,0.0,1.0,0.0,0,0,0,-1
954247439,GIL N. MILEIKOWSKY PROFIT SHARING PLAN & TRUST,Multi Employer,,0.0,0.0,0.0,0.5,0.0,0.0,1.0,0.0,0,0,0,-1
208175031,"BOBBY BUKA, M.D., P.C. PROFIT SHARING PLAN",Multi Employer,55.0,4.0,8134.0,0.44922547332185886,0.2963855421686747,121111111111.0,5.0,0.3333333333333333,0.6678356713426854,0,3,1,1
421761633,"MID MISSOURI CAR CARE, INC. PROFIT SHARING PLAN",Multi Employer,6.0,0.0,0.0,0.0,0.5,0.0,0.0,1.0,0.0,0,0,0,-1
205404353,CHRIST COMMUNITY HEALTH SERVICES EMPLOYEE BENEFIT PLAN (501),Multi Employer,86.0,3.0,110367.0,0.611459947266846,0.8626506024096385,1.1111111111111112e+39,0.0,0.5,0.611459947266846,0,3,1,1
364999450,"STOKOL + FAGALA OPTOMETRY, PLLC PROFIT SHARING PLAN",Multi Employer,13.0,0.0,0.0,0.0,0.5,0.0,0.0,1.0,0.0,0,0,0,-1
831254672,MORPHOSYS US INC. 401(K) PLAN,Multi Employer,0.0,2.0,82718.0,0.7264561522280519,0.8,1.1111111111211113e+56,1082.4742979242988,0.5,1.0,0,6,1,0
861386906,POOLS ON THE GULF HEALTH AND WELFARE BENEFIT PLAN,Multi Employer,112.0,0.0,0.0,0.0,0.5,0.0,0.0,1.0,0.0,0,0,0,-1
666054072,FILOZANO RETIREMENT PLAN,Multi Employer,1.0,0.0,0.0,0.0,0.5,0.0,0.0,1.0,0.0,0,0,0,-1
842761183,SSPROTTE6 CO. RETIREMENT PLAN,Multi Employer,4.0,0.0,0.0,0.0,0.5,0.0,0.0,1.0,0.0,0,0,0,-1
861568686,N TEXAS PB CORP. 401(K) PLAN,Multi Employer,0.0,0.0,0.0,0.0,0.5,0.0,0.0,1.0,0.0,0,0,0,-1
842858423,HAYSTACK RECRUITING INC. RETIREMENT PLAN,Multi Employer,1.0,0.0,0.0,0.0,0.5,0.0,0.0,1.0,0.0,0,0,0,-1
871921784,"SHEEPDOG ENTERPRISES, INC. 401(K) PLAN",Multi Employer,2.0,0.0,0.0,0.0,0.5,0.0,0.0,1.0,0.0,0,0,0,-1
666054922,IVETTE SANCHEZ KEOGH PLAN,Multi Employer,1.0,0.0,0.0,0.0,0.5,0.0,0.0,1.0,0.0,0,0,0,-1
930603046,MEDICAL EYE CENTER GROUP HEALTH PLAN,Multi Employer,111.0,0.0,0.0,0.0,0.5,0.0,0.0,1.0,0.0,0,0,0,-1
584541633,P FALTO DETRES RETIREMENT PLAN,Multi Employer,1.0,0.0,0.0,0.0,0.5,0.0,0.0,1.0,0.0,0,0,0,-1
261990516,MILLER HELPERS INC. PROFIT SHARING PLAN,Multi Employer,91.0,0.0,0.0,0.0,0.5,0.0,0.0,1.0,0.0,0,0,0,-1
205640906,"P&D ENTERPRISES, INC. 401(K) PLAN",Multi Employer,0.0,0.0,0.0,0.0,0.5,0.0,0.0,1.0,0.0,0,0,0,-1
922284041,CHILDREN 1ST PEDIATRICS 401K AND PROFIT SHARING PLAN,Multi Employer,9.0,0.0,0.0,0.0,0.5,0.0,0.0,1.0,0.0,0,0,0,-1
332896809,SHURIWOLF PUBLISHING CORPORATION 401(K) PLAN,Multi Employer,1.0,0.0,0.0,0.0,0.5,0.0,0.0,1.0,0.0,0,0,0,-1
991358472,VRA SERVICES INC. RETIREMENT PLAN,Multi Employer,1.0,0.0,0.0,0.0,0.5,0.0,0.0,1.0,0.0,0,0,0,-1
990209733,"JOHN M. JONES, D.D.S., INC. PROFIT SHARING PLAN",Multi Employer,0.0,0.0,0.0,0.0,0.5,0.0,0.0,1.0,0.0,0,0,0,-1
640922204,"COMMUNITY ELDERCARE SERVICES, LLC EMPLOYEE BENEFITS PLAN",Multi Employer,1039.0,0.0,0.0,0.0,0.5,0.0,0.0,1.0,0.0,0,0,0,-1
50508079,ANCHOR MEDICAL ASSOCIATES RETIREMENT PLAN,Multi Employer,0.0,0.0,0.0,0.0,0.5,0.0,0.0,1.0,0.0,0,0,0,-1
570699834,"JIMMY MARTIN REALTY GROUP, INC. 401(K) PLAN",Multi Employer,2.0,0.0,0.0,0.0,0.5,0.0,0.0,1.0,0.0,0,0,0,-1
540595482,VALLEY OIL CORPORATION PROFIT SHARING PLAN,Multi Employer,0.0,0.0,0.0,0.0,0.5,0.0,0.0,1.0,0.0,0,0,0,-1
262947027,PATTERSON HOLDINGS LLC,Multi Employer,9.0,0.0,0.0,0.0,0.5,0.0,0.0,1.0,0.0,0,0,0,-1
994645721,CHARMAR CO. RETIREMENT PLAN,Multi Employer,2.0,0.0,0.0,0.0,0.5,0.0,0.0,1.0,0.0,0,0,0,-1
882385502,WNB ENDEAVORS INC. RETIREMENT PLAN,Multi Employer,0.0,0.0,0.0,0.0,0.5,0.0,0.0,1.0,0.0,0,0,0,-1
991048844,WOLFCREST CONSULTING INC. 401(K) PLAN,Multi Employer,1.0,0.0,0.0,0.0,0.5,0.0,0.0,1.0,0.0,0,0,0,-1
314152900,"COLUMBUS BUILDERS SUPPLY, INC. PROFIT SHARING PLAN",Multi Employer,39.0,0.0,0.0,0.0,0.5,0.0,0.0,1.0,0.0,0,0,0,-1
934938679,ONDREJKA ENTERPRISES RETIREMENT PLAN,Multi Employer,5.0,0.0,0.0,0.0,0.5,0.0,0.0,1.0,0.0,0,0,0,-1
466654951,LGBT BENEFIT PLAN TRUST,Multi Employer,0.0,4.0,106640.0,0.5626406601650412,0.8578313253012049,0.0,0.0,1.0,0.0,0,1,1,1
591923325,401(K) PROFIT SHARING PLAN FOR EMPLOYEES OF SUTTER ROOFING COMPANY OF FLORIDA,Multi Employer,0.0,0.0,0.0,0.0,0.5,0.0,0.0,1.0,0.0,0,0,0,-1
811919125,ISLAND LIFE GRAPHICS INC. RETIREMENT PLAN,Multi Employer,5.0,0.0,0.0,0.0,0.5,0.0,0.0,1.0,0.0,0,0,0,-1
660577514,STERLING CONSULTING PROFIT SHARING PLAN,Multi Employer,1.0,0.0,0.0,0.0,0.5,0.0,0.0,1.0,0.0,0,0,0,-1
331682204,DELLA WELLNESS STUDIOS INC. RETIREMENT PLAN,Multi Employer,1.0,0.0,0.0,0.0,0.5,0.0,0.0,1.0,0.0,0,0,0,-1
161490676,CANTERBURY WOODS 401(K) RETIREMENT SAVINGS PLAN,Multi Employer,133.0,2.0,37671.0,1.0,0.6313253012048192,1.1111111111111113e+42,0.0,0.5,0.0,0,4,1,0
831705854,TEN ONE RETIREMENT PLAN,Multi Employer,1.0,0.0,0.0,0.0,0.5,0.0,0.0,1.0,0.0,0,0,0,-1
301030292,AMENDED AND RESTATED AFFINITY BANK EMPLOYEE STOCK OWNERSHIP PLAN,Multi Employer,74.0,0.0,0.0,0.0,0.5,0.0,0.0,1.0,0.0,0,0,0,-1
273655340,SS TOOLS RETIREMENT PLAN,Multi Employer,1.0,0.0,0.0,0.0,0.5,0.0,0.0,1.0,0.0,0,0,0,-1
953360882,CRESTWOOD CORPORATION PROFIT SHARING PLAN,Multi Employer,2.0,0.0,0.0,0.0,0.5,0.0,0.0,1.0,0.0,0,0,0,-1
863157271,KONCUSSION INC. RETIREMENT PLAN,Multi Employer,1.0,0.0,0.0,0.0,0.5,0.0,0.0,1.0,0.0,0,0,0,-1
232610181,"TRI COUNTY AUTO CENTER, LTD. GROUP INSURANCE PLAN",Multi Employer,119.0,4.0,44714.0,0.5400992977590912,0.6771084337349398,1.121121221121122e+40,52.0,0.5,0.9540859686004384,0,3,1,1
273225082,"EUROFINS SCIENTIFIC, INC. 401(K) INCENTIVE SAVINGS PLAN",Multi Employer,13276.0,6.0,1398112.0,0.7253853768510677,0.9975903614457832,1111.0,251.0,0.25,0.1110576262845895,0,4,1,0
223832919,NAPCO INTERNATIONAL UAW LOCAL NO. 125 RETIREMENT INCOME PLAN,Multi Employer,0.0,0.0,0.0,0.0,0.5,0.0,0.0,1.0,0.0,0,0,0,-1
540808781,"INTERSTATE INDUSTRIES, INC. 401(K) PLAN",Multi Employer,0.0,0.0,0.0,0.0,0.5,0.0,0.0,1.0,0.0,0,0,0,-1
580325681,"J. C. LEWIS MOTOR COMPANY, INC. GROUP INSURANCE PLAN",Multi Employer,1300.0,0.0,0.0,0.0,0.5,0.0,0.0,1.0,0.0,0,0,0,-1
392459725,STASKO AND SONS TRAINING RETIREMENT PLAN,Multi Employer,1.0,0.0,0.0,0.0,0.5,0.0,0.0,1.0,0.0,0,0,0,-1
260399620,"BEARTOOTH INVESTMENTS, INC. 401(K) PLAN",Multi Employer,2.0,0.0,0.0,0.0,0.5,0.0,0.0,1.0,0.0,0,0,0,-1
392053184,A & A HARRIS ENTERPRISES 401(K) PLAN,Multi Employer,6.0,0.0,0.0,0.0,0.5,0.0,0.0,1.0,0.0,0,0,0,-1
841072256,"ACCELERATE DIAGNOSTICS, INC. WELFARE PLAN",Multi Employer,0.0,0.0,0.0,0.0,0.5,0.0,0.0,1.0,0.0,0,0,0,-1
942537238,SERVICE BY MEDALLION 401(K) & RETIREMENT PLAN,Multi Employer,126.0,3.0,33571.0,0.5490750945756754,0.6048192771084338,2.211111111111112e+45,312.17140060022405,1.0,0.5490750945756754,0,4,1,0
660802684,SAMUEL LOPEZ RISQUELMI RETIREMENT PLAN,Multi Employer,1.0,0.0,0.0,0.0,0.5,0.0,0.0,1.0,0.0,0,0,0,-1
273378114,CHRISTENSEN LAW FIRM 401(K) PLAN,Multi Employer,18.0,0.0,0.0,0.0,0.5,0.0,0.0,1.0,0.0,0,0,0,-1
760486589,"DUFF, KITCHEL & COMPANY, P.C. 401(K) PROFIT SHARING PLAN",Multi Employer,15.0,0.0,0.0,0.0,0.5,0.0,0.0,1.0,0.0,0,0,0,-1
862417883,ELLCON CORP 401(K) PLAN,Multi Employer,0.0,0.0,0.0,0.0,0.5,0.0,0.0,1.0,0.0,0,0,0,-1
832893939,THREE OAKS VENTURES INC. RETIREMENT PLAN,Multi Employer,3.0,0.0,0.0,0.0,0.5,0.0,0.0,1.0,0.0,0,0,0,-1
840581547,AMERICAN FURNITURE WAREHOUSE CO. TEXAS OCCUPATIONAL INJURY BENEFIT PLAN,Multi Employer,612.0,0.0,0.0,0.0,0.5,0.0,0.0,1.0,0.0,0,0,0,-1
942441947,GILMARTIN AND TREVOR A LAW CORP PROFIT SHARING PLAN,Multi Employer,0.0,0.0,0.0,0.0,0.5,0.0,0.0,1.0,0.0,0,0,0,-1
134043930,"COMMINGLED PENSION TRUST FUND (INTERNATIONAL RESEARCH ENHANCED EQUITY II) OF JPMORGAN CHASE BANK, N.A.",DFE,,0.0,0.0,0.0,0.5,0.0,0.0,1.0,0.0,0,0,0,-1
991279754,CRYSTAL ZAIK CONSULTING CORP. 401(K) PLAN,Multi Employer,1.0,0.0,0.0,0.0,0.5,0.0,0.0,1.0,0.0,0,0,0,-1
132742395,"ARC-COM FABRICS, INC. RETIREMENT PLAN",Multi Employer,0.0,3.0,35188.0,0.8556610208025464,0.6168674698795181,2.1111111111111207e+44,61.171400600223855,0.5,0.0,0,3,1,1
394149431,"H&H BUSINESS COLLECTIVE, INC. 401(K) RETIREMENT PLAN",Multi Employer,1.0,0.0,0.0,0.0,0.5,0.0,0.0,1.0,0.0,0,0,0,-1
371895245,"PRECISE TRANSPORTATION, INC. RETIREMENT PLAN",Multi Employer,3.0,0.0,0.0,0.0,0.5,0.0,0.0,1.0,0.0,0,0,0,-1
251792083,"STERLING MACHINE TECHNOLOGIES, INC. EMPLOYEE BENEFIT PLAN",Multi Employer,34.0,4.0,122011.0,0.44873003253804983,0.8722891566265061,3.112122211311122e+39,0.0,0.5,0.9192226995703866,0,3,1,1
884110304,CHROMY CORPORATION 401(K) PLAN,Multi Employer,0.0,0.0,0.0,0.0,0.5,0.0,0.0,1.0,0.0,0,0,0,-1
630674849,"JORDAN MACHINE CO, INC 401(K) PROFIT SHARING PLAN",Multi Employer,20.0,0.0,0.0,0.0,0.5,0.0,0.0,1.0,0.0,0,0,0,-1
660760182,"CONCEPTOS DENTALES DEL SUR, PSC RETIREMENT PLAN",Multi Employer,7.0,0.0,0.0,0.0,0.5,0.0,0.0,1.0,0.0,0,0,0,-1
208066203,GASSEARCH DRILLING SERVICES CORPORATION 401(K) PLAN,Multi Employer,0.0,1.0,1627.0,1.0,0.1493975903614458,1.1111111111111112e+53,0.0,1.0,1.0,0,7,1,0
581279324,I. SANTOS-SANCHEZ RETIREMENT PLAN,Multi Employer,1.0,0.0,0.0,0.0,0.5,0.0,0.0,1.0,0.0,0,0,0,-1
270630594,"IANDR ENTERPRISES, INC. 401(K) PLAN",Multi Employer,0.0,0.0,0.0,0.0,0.5,0.0,0.0,1.0,0.0,0,0,0,-1
990623669,"LIKVIDECO, INC. RETIREMENT PLAN",Multi Employer,2.0,0.0,0.0,0.0,0.5,0.0,0.0,1.0,0.0,0,0,0,-1
821042484,"INKBOX PRINTING 2.0, INC. 401K PROFIT SHARING PLAN",Multi Employer,10.0,0.0,0.0,0.0,0.5,0.0,0.0,1.0,0.0,0,0,0,-1
822969009,"DARK ENTERPRISES, INC. ROTH 401(K) RETIREMENT PLAN",Multi Employer,2.0,0.0,0.0,0.0,0.5,0.0,0.0,1.0,0.0,0,0,0,-1
351966829,"OTOLARYNGOLOGY ASSOCIATES, LLC GROUP HEALTH PLAN",Multi Employer,106.0,0.0,0.0,0.0,0.5,0.0,0.0,1.0,0.0,0,0,0,-1
411679714,ADVANTAGE MANAGEMENT CORPORATION DELTA DENTAL,Multi Employer,400.0,0.0,0.0,0.0,0.5,0.0,0.0,1.0,0.0,0,0,0,-1
841900488,"ONPOINT HEALTHCARE PARTNERS, INC. 401(K) PLAN",Multi Employer,8.0,0.0,0.0,0.0,0.5,0.0,0.0,1.0,0.0,0,0,0,-1
852571834,HAPPY HEART ENTERPRISES INC. RETIREMENT PLAN,Multi Employer,1.0,0.0,0.0,0.0,0.5,0.0,0.0,1.0,0.0,0,0,0,-1
261260009,DEARBORN NATIONAL LIFE & SHORT TERM DISABILITY PLAN,Multi Employer,100.0,0.0,0.0,0.0,0.5,0.0,0.0,1.0,0.0,0,0,0,-1
471658389,TANGLIN RETIREMENT PLAN,Multi Employer,1.0,0.0,0.0,0.0,0.5,0.0,0.0,1.0,0.0,0,0,0,-1
943074344,OREGON SUPPORTED LIVING PROGRAM HEALTH BENEFITS PLAN,Multi Employer,173.0,0.0,0.0,0.0,0.5,0.0,0.0,1.0,0.0,0,0,0,-1
823830537,"LAT 30 FINISHES, INC. RETIREMENT PLAN",Multi Employer,3.0,0.0,0.0,0.0,0.5,0.0,0.0,1.0,0.0,0,0,0,-1
942548776,NOON INTERNATIONAL PROFIT SHARING PLAN,Multi Employer,2.0,0.0,0.0,0.0,0.5,0.0,0.0,1.0,0.0,0,0,0,-1
862135693,J&C BRANDING INC. RETIREMENT PLAN,Multi Employer,1.0,0.0,0.0,0.0,0.5,0.0,0.0,1.0,0.0,0,0,0,-1
752372684,CULINAIRE INTERNATIONAL BENEFITS PLAN,Multi Employer,163.0,2.0,23245.0,0.6274037427403742,0.4795180722891566,1.1111111111111112e+53,0.0,1.0,0.3725962572596257,0,3,1,1
112713216,JACKSON CORPORATION 401(K) PLAN,Multi Employer,0.0,0.0,0.0,0.0,0.5,0.0,0.0,1.0,0.0,0,0,0,-1
883838370,POWELL DYNAMICS INC. RETIREMENT PLAN,Multi Employer,1.0,0.0,0.0,0.0,0.5,0.0,0.0,1.0,0.0,0,0,0,-1
461565580,"GUARDIAN FUNERAL SERVICE, INC. RETIREMENT PLAN",Multi Employer,3.0,0.0,0.0,0.0,0.5,0.0,0.0,1.0,0.0,0,0,0,-1
42702169,"CHMC ANESTHESIA FOUNDATION, INC. MEDICAL EXPENSE REIMBURSEMENT PLAN",Multi Employer,156.0,0.0,0.0,0.0,0.5,0.0,0.0,1.0,0.0,0,0,0,-1
