ein,plan_name,fund_type,num_participants,num_managers,total_fees,top_manager_concentration,fee_percentile,total_shared_managers,betweenness_score,community_concentration,same_parent_fee_ratio,in_circular_pattern,risk_score,has_manager_data,label
812704975,ARISTOTLE COLLECTIVE INVESTMENT TRUST,DFE,,0.0,0.0,0.0,0.5,0.0,0.0,1.0,0.0,0,0,0,-1
825499317,BRIGADE COLLECTIVE INVESTMENT TRUST,DFE,,0.0,0.0,0.0,0.5,0.0,0.0,1.0,0.0,0,0,0,-1
811085578,AXIOM INVESTORS COLLECTIVE INVESTMENT TRUST,DFE,,0.0,0.0,0.0,0.5,0.0,0.0,1.0,0.0,0,0,0,-1
264377500,EARNEST PARTNERS MULTIPLE INVESTMENT TRUST,DFE,,0.0,0.0,0.0,0.5,0.0,0.0,1.0,0.0,0,0,0,-1
991917716,FPA COLLECTIVE INVESTMENT TRUST,DFE,,0.0,0.0,0.0,0.5,0.0,0.0,1.0,0.0,0,0,0,-1
473293725,KBI GLOBAL INVESTORS (NA) LTD CIT,DFE,,0.0,0.0,0.0,0.5,0.0,0.0,1.0,0.0,0,0,0,-1
473260276,FIERA ASSET MANAGEMENT USA COLLECTIVE TRUST,DFE,,0.0,0.0,0.0,0.5,0.0,0.0,1.0,0.0,0,0,0,-1
883781160,CONSOLIDATED CLARITY CORPORATION 401(K) PLAN,Multi Employer,1.0,0.0,0.0,0.0,0.5,0.0,0.0,1.0,0.0,0,0,0,-1
990481447,"LUMINALIUS, INC. PROFIT SHARING PLAN",Multi Employer,0.0,0.0,0.0,0.0,0.5,0.0,0.0,1.0,0.0,0,0,0,-1
473425348,OCEANSIDE HEALTHCARE STAFFING INCORPORATED 401(K) PLAN,Multi Employer,2.0,0.0,0.0,0.0,0.5,0.0,0.0,1.0,0.0,0,0,0,-1
882562124,"INFINITE FLEX, INC. RETIREMENT PLAN",Multi Employer,0.0,0.0,0.0,0.0,0.5,0.0,0.0,1.0,0.0,0,0,0,-1
850889224,KKS INCORPORATED RETIREMENT PLAN,Multi Employer,1.0,0.0,0.0,0.0,0.5,0.0,0.0,1.0,0.0,0,0,0,-1
823992909,JARS HOLDINGS LLC 401(K) PLAN,Multi Employer,0.0,0.0,0.0,0.0,0.5,0.0,0.0,1.0,0.0,0,0,0,-1
832019922,"DON BECK HOLDINGS, INC. 401(K) PLAN",Multi Employer,0.0,0.0,0.0,0.0,0.5,0.0,0.0,1.0,0.0,0,0,0,-1
463047049,"GENIUS IN TRAINING, INC. 401(K) PLAN",Multi Employer,2.0,0.0,0.0,0.0,0.5,0.0,0.0,1.0,0.0,0,0,0,-1
814170527,"BE SUNSHINE, LLC 401(K) PLAN",Multi Employer,146.0,1.0,10483.0,1.0,0.3421686746987952,11111111111111.0,0.0,1.0,0.0,0,5,1,0
920715193,"KOVICAK ENTERPRISES, INC. 401(K) PROFIT SHARING PLAN",Multi Employer,0.0,0.0,0.0,0.0,0.5,0.0,0.0,1.0,0.0,0,0,0,-1
340660433,ROBERTSON HEATING SUPPLY COMPANY WELFARE BENEFIT PLAN,Multi Employer,0.0,0.0,0.0,0.0,0.5,0.0,0.0,1.0,0.0,0,0,0,-1
41355545,GFA FEDERAL CREDIT UNION 401(K) PROFIT SHARING PLAN,Multi Employer,0.0,0.0,0.0,0.0,0.5,0.0,0.0,1.0,0.0,0,0,0,-1
660559417,CARIBBEAN MEDICAL CENTER 1081.01(D) RETIREMENT PLAN,Multi Employer,178.0,0.0,0.0,0.0,0.5,0.0,0.0,1.0,0.0,0,0,0,-1
562594012,BRETT DINOVI & ASSOCIATES LLC WELFARE BENEFIT PLAN,Multi Employer,488.0,0.0,0.0,0.0,0.5,0.0,0.0,1.0,0.0,0,0,0,-1
261663468,RIVER'S EDGE DENTAL CLINIC 401(K)/PROFIT SHARING PLAN,Multi Employer,12.0,0.0,0.0,0.0,0.5,0.0,0.0,1.0,0.0,0,0,0,-1
472779215,"AJ MACHINING, LLC 401(K)/PROFIT SHARING PLAN",Multi Employer,13.0,0.0,0.0,0.0,0.5,0.0,0.0,1.0,0.0,0,0,0,-1
201057056,CHARLES D WOODS MD PC 401K PROFIT SHARING PLAN,Multi Employer,6.0,0.0,0.0,0.0,0.5,0.0,0.0,1.0,0.0,0,0,0,-1
720917032,"FLUID DISPOSAL SPECIALTIES, INC. LIFE INSURANCE PLAN",Multi Employer,131.0,0.0,0.0,0.0,0.5,0.0,0.0,1.0,0.0,0,0,0,-1
842131830,THE SENSIA 401(K) SAVINGS PLAN,Multi Employer,284.0,0.0,0.0,0.0,0.5,0.0,0.0,1.0,0.0,0,0,0,-1
852579843,SBC DEVELOPMENT AND PROPERTY MANAGEMENT INC. RETIREMENT PLAN,Multi Employer,1.0,0.0,0.0,0.0,0.5,0.0,0.0,1.0,0.0,0,0,0,-1
583659664,BENITEZ CAMACHO PENSION TRUST,Multi Employer,1.0,0.0,0.0,0.0,0.5,0.0,0.0,1.0,0.0,0,0,0,-1
631236235,ROBERT GORDON MOWRY MD 401(K) PROFIT SHARING PLAN,Multi Employer,0.0,0.0,0.0,0.0,0.5,0.0,0.0,1.0,0.0,0,0,0,-1
132775750,COMPREHENSIVE HEALTH PLAN FOR EMPLOYEES OF BANK HAPOALIM B.M.,Multi Employer,243.0,0.0,0.0,0.0,0.5,0.0,0.0,1.0,0.0,0,0,0,-1
584795642,J ACEVEDO ORENGO RETIREMENT PLAN,Multi Employer,1.0,0.0,0.0,0.0,0.5,0.0,0.0,1.0,0.0,0,0,0,-1
870563379,"GOENGINEER, INC. WELFARE BENEFITS PLAN",Multi Employer,693.0,0.0,0.0,0.0,0.5,0.0,0.0,1.0,0.0,0,0,0,-1
352168757,"JONES FAMILY MEDICINE CLINIC, PLLC CASH BALANCE PLAN",Multi Employer,0.0,0.0,0.0,0.0,0.5,0.0,0.0,1.0,0.0,0,0,0,-1
863687551,"VIGENT, INC. 401(K) PROFIT SHARING PLAN",Multi Employer,3.0,0.0,0.0,0.0,0.5,0.0,0.0,1.0,0.0,0,0,0,-1
646026549,"MISSISSIPPI METHODIST SENIOR SERVICES, INC. SECTION 125 CAFETERIA PLAN",Multi Employer,108.0,0.0,0.0,0.0,0.5,0.0,0.0,1.0,0.0,0,0,0,-1
232883723,"GENESIS ENGINEERS, INC. HEALTH REIMBURSEMENT ARRANGEMENT",Multi Employer,275.0,0.0,0.0,0.0,0.5,0.0,0.0,1.0,0.0,0,0,0,-1
582653903,MT PEREA FERNANDEZ RETIREMENT PLAN,Multi Employer,1.0,0.0,0.0,0.0,0.5,0.0,0.0,1.0,0.0,0,0,0,-1
221494434,FAIRLEIGH DICKINSON UNIVERSITY EMPLOYEE BENEFIT PLAN,Multi Employer,907.0,0.0,0.0,0.0,0.5,0.0,0.0,1.0,0.0,0,0,0,-1
264757392,HARRIS ASSOCIATES COLLECTIVE INVESTMENT TRUST,DFE,,0.0,0.0,0.0,0.5,0.0,0.0,1.0,0.0,0,0,0,-1
830686634,PINEBRIDGE COLLECTIVE INVESTMENT TRUST,DFE,,0.0,0.0,0.0,0.5,0.0,0.0,1.0,0.0,0,0,0,-1
812617494,POLEN CAPITAL MASTER COLLECTIVE INVESTMENT TRUST,DFE,,0.0,0.0,0.0,0.5,0.0,0.0,1.0,0.0,0,0,0,-1
272402927,RAINIER MULTIPLE INVESTMENT TRUST,DFE,,0.0,0.0,0.0,0.5,0.0,0.0,1.0,0.0,0,0,0,-1
850894185,SANDS CAPITAL COLLECTIVE INVESTMENT TRUST,DFE,,0.0,0.0,0.0,0.5,0.0,0.0,1.0,0.0,0,0,0,-1
516567688,SEI OPPORTUNITY COLLECTIVE FUND,DFE,,0.0,0.0,0.0,0.5,0.0,0.0,1.0,0.0,0,0,0,-1
820827441,TOCQUEVILLE MASTER COLLECTIVE INVESTMENT TRUST,DFE,,0.0,0.0,0.0,0.5,0.0,0.0,1.0,0.0,0,0,0,-1
842543540,WCM COLLECTIVE INVESTMENT TRUST,DFE,,0.0,0.0,0.0,0.5,0.0,0.0,1.0,0.0,0,0,0,-1
825392117,"MURRAY DUPLEX, LLC 401(K) PLAN",Multi Employer,1.0,0.0,0.0,0.0,0.5,0.0,0.0,1.0,0.0,0,0,0,-1
391986647,ZSI EMPLOYEE STOCK OWNERSHIP PLAN,Multi Employer,0.0,0.0,0.0,0.0,0.5,0.0,0.0,1.0,0.0,0,0,0,-1
274542597,ARIZONA IP HOLDING COMPANY 401K PROFIT SHARING PLAN,Multi Employer,3.0,0.0,0.0,0.0,0.5,0.0,0.0,1.0,0.0,0,0,0,-1
872926524,"ZFBHATTI, INC. 401(K) PROFIT SHARING PLAN",Multi Employer,0.0,0.0,0.0,0.0,0.5,0.0,0.0,1.0,0.0,0,0,0,-1
872007795,ZIMVIE INC. PUERTO RICO SAVINGS AND INVESTMENT 401(K) PROGRAM,Multi Employer,0.0,4.0,3517.0,0.48791583736138755,0.18795180722891566,1.1121121112111111e+55,582.1295343545348,0.3333333333333333,0.5575774808075064,0,3,1,1
331597882,SECOND WIND G5 INC. RETIREMENT PLAN,Multi Employer,2.0,0.0,0.0,0.0,0.5,0.0,0.0,1.0,0.0,0,0,0,-1
871120047,UNIVERSE V INCORPORATED 401(K) PROFIT SHARING PLAN,Multi Employer,0.0,0.0,0.0,0.0,0.5,0.0,0.0,1.0,0.0,0,0,0,-1
581816279,NORIS M. DIAZ ROMERO RETIREMENT PLAN,Multi Employer,1.0,0.0,0.0,0.0,0.5,0.0,0.0,1.0,0.0,0,0,0,-1
874760540,NL STARFISH PARTNERS HEALTH AND WELFARE PLAN,Multi Employer,196.0,0.0,0.0,0.0,0.5,0.0,0.0,1.0,0.0,0,0,0,-1
800866775,RIGHTSLINE EMPLOYEE BENEFITS PLAN,Multi Employer,105.0,0.0,0.0,0.0,0.5,0.0,0.0,1.0,0.0,0,0,0,-1
463202456,TOMMY TWOS INC PROFIT SHARING PLAN,Multi Employer,2.0,0.0,0.0,0.0,0.5,0.0,0.0,1.0,0.0,0,0,0,-1
202114632,"PAGADOKI, INC. PROFIT SHARING PLAN & TRUST",Multi Employer,5.0,0.0,0.0,0.0,0.5,0.0,0.0,1.0,0.0,0,0,0,-1
583988571,ELSA MARGARITA SAAVEDRA RETIEREMENT PLAN,Multi Employer,1.0,0.0,0.0,0.0,0.5,0.0,0.0,1.0,0.0,0,0,0,-1
650608221,BUOY PEO POOLED EMPLOYER PLAN,Multiple Employer,35.0,0.0,0.0,0.0,0.5,0.0,0.0,1.0,0.0,0,0,0,-1
463799394,"MINDCARE SOLUTIONS GROUP, INC. HEALTH AND WELFARE PLANS",Multi Employer,126.0,0.0,0.0,0.0,0.5,0.0,0.0,1.0,0.0,0,0,0,-1
621749417,"TENNESSEE TRACTOR, LLC SECTION 125 FLEXIBLE BENEFITS PLAN",Multi Employer,112.0,0.0,0.0,0.0,0.5,0.0,0.0,1.0,0.0,0,0,0,-1
825278759,"TOLEDO DRYER VENT, INC. 401(K) PLAN",Multi Employer,1.0,0.0,0.0,0.0,0.5,0.0,0.0,1.0,0.0,0,0,0,-1
825298472,"WTR ENTERPRISE, INC. 401(K) PLAN",Multi Employer,17.0,0.0,0.0,0.0,0.5,0.0,0.0,1.0,0.0,0,0,0,-1
874242776,WHITE FEATHER CORP. 401(K) PLAN,Multi Employer,1.0,0.0,0.0,0.0,0.5,0.0,0.0,1.0,0.0,0,0,0,-1
475575982,LOBERG & LOBERG MONEY PURCHASE PLAN,Multi Employer,9.0,0.0,0.0,0.0,0.5,0.0,0.0,1.0,0.0,0,0,0,-1
882096469,THIRSTY WOLF INC. RETIREMENT PLAN,Multi Employer,1.0,0.0,0.0,0.0,0.5,0.0,0.0,1.0,0.0,0,0,0,-1
833119016,FELLOW TRAVELERS HEALTH & WELFARE PLAN,Multiple Employer,26.0,0.0,0.0,0.0,0.5,0.0,0.0,1.0,0.0,0,0,0,-1
992583494,SUGAR CONFETTI LASHES INC. RETIREMENT PLAN,Multi Employer,1.0,0.0,0.0,0.0,0.5,0.0,0.0,1.0,0.0,0,0,0,-1
331842629,GSC GINGER SPICE CREATIONS INC. RETIREMENT PLAN,Multi Employer,2.0,0.0,0.0,0.0,0.5,0.0,0.0,1.0,0.0,0,0,0,-1
813302125,STRATEGIC GLOBAL ADVISORS COLLECTIVE INVESTMENT TRUST,DFE,,0.0,0.0,0.0,0.5,0.0,0.0,1.0,0.0,0,0,0,-1
262447110,WESTWOOD MULTIPLE INVESTMENT TRUST,DFE,,0.0,0.0,0.0,0.5,0.0,0.0,1.0,0.0,0,0,0,-1
454594953,PALISADE CAPITAL MASTER COLLECTIVE INVESTMENT TRUST,DFE,,0.0,0.0,0.0,0.5,0.0,0.0,1.0,0.0,0,0,0,-1
251719434,CEI MEDICAL PLAN,Multi Employer,209.0,0.0,0.0,0.0,0.5,0.0,0.0,1.0,0.0,0,0,0,-1
873825824,"FIJI FITNESS, INC. 401(K) PLAN",Multi Employer,0.0,0.0,0.0,0.0,0.5,0.0,0.0,1.0,0.0,0,0,0,-1
311160046,"LYON VIDEO, INC. EMPLOYEE STOCK OWNERSHIP PLAN",Multi Employer,0.0,0.0,0.0,0.0,0.5,0.0,0.0,1.0,0.0,0,0,0,-1
362989662,INTERNATIONAL SHIPHOLDING CORPORATION RETIREMENT PLAN,Multi Employer,0.0,4.0,176437.0,0.5398640874646474,0.9156626506024096,1.1111111111111112e+45,883.3697557344611,0.3333333333333333,0.2349280479717973,0,2,1,1
942169389,ASSOCIATED FEED & SUPPLY WELFARE BENEFIT PLAN,Multi Employer,154.0,0.0,0.0,0.0,0.5,0.0,0.0,1.0,0.0,0,0,0,-1
203602788,TRANS CORPORATION 401(K) PLAN,Multi Employer,17.0,0.0,0.0,0.0,0.5,0.0,0.0,1.0,0.0,0,0,0,-1
475438043,SUMMIT AVE. SERVICES INCORPORATED 401(K) PROFIT SHARING PLAN,Multi Employer,0.0,0.0,0.0,0.0,0.5,0.0,0.0,1.0,0.0,0,0,0,-1
621308417,BRADLEY COUNTY FINANCIAL CORPORATION 401(K) PLAN,Multi Employer,0.0,0.0,0.0,0.0,0.5,0.0,0.0,1.0,0.0,0,0,0,-1
473807885,"WICKWIRE BUSINESS SERVICES, INC. RETIREMENT PLAN",Multi Employer,2.0,0.0,0.0,0.0,0.5,0.0,0.0,1.0,0.0,0,0,0,-1
834046428,KIND ENTERPRISES INC. RETIREMENT PLAN,Multi Employer,1.0,0.0,0.0,0.0,0.5,0.0,0.0,1.0,0.0,0,0,0,-1
420885471,"GEATER MACHINING & MANUFACTURING CO., INC. RETIREMENT SAVINGS PLAN",Multi Employer,0.0,3.0,38949.0,0.5077408919356081,0.636144578313253,121.0,0.0,0.5,0.0,0,1,1,1
881466537,DIVERSIFIED MEDBILL PLUS INC. RETIREMENT PLAN,Multi Employer,2.0,0.0,0.0,0.0,0.5,0.0,0.0,1.0,0.0,0,0,0,-1
272260266,"MCGEE MOTORS, INC. PROFIT SHARING PLAN",Multi Employer,3.0,0.0,0.0,0.0,0.5,0.0,0.0,1.0,0.0,0,0,0,-1
921314683,SKY RIVER ENDEAVORS INC. RETIREMENT PLAN,Multi Employer,0.0,0.0,0.0,0.0,0.5,0.0,0.0,1.0,0.0,0,0,0,-1
341848737,RIFFLE MACHINE WORKS BENEFIT PLAN,Multi Employer,204.0,0.0,0.0,0.0,0.5,0.0,0.0,1.0,0.0,0,0,0,-1
584667238,H. FLORES ALMODOVAR RETIREMENT PLAN,Multi Employer,2.0,0.0,0.0,0.0,0.5,0.0,0.0,1.0,0.0,0,0,0,-1
431302908,NODAWAY VALLEY BANK FLEXIBLE BENEFITS PLAN,Multi Employer,159.0,0.0,0.0,0.0,0.5,0.0,0.0,1.0,0.0,0,0,0,-1
475280979,BARED MONKEY INC 401K PLAN,Multi Employer,2.0,0.0,0.0,0.0,0.5,0.0,0.0,1.0,0.0,0,0,0,-1
474773249,"RLT, INC 401(K) PLAN",Multi Employer,5.0,0.0,0.0,0.0,0.5,0.0,0.0,1.0,0.0,0,0,0,-1
992923038,"BRADY MARTZ & ASSOCIATES, PC HEALTH AND WELFARE BENEFIT PLAN",Multi Employer,375.0,0.0,0.0,0.0,0.5,0.0,0.0,1.0,0.0,0,0,0,-1
933104940,CLEAN HOME LIVING RETIREMENT PLAN,Multi Employer,5.0,0.0,0.0,0.0,0.5,0.0,0.0,1.0,0.0,0,0,0,-1
473099210,OJO LABS 401(K) PLAN,Multi Employer,0.0,0.0,0.0,0.0,0.5,0.0,0.0,1.0,0.0,0,0,0,-1
822480593,EVEREST BUSINESS CONNECTIONS CORP. RETIREMENT PLAN,Multi Employer,1.0,0.0,0.0,0.0,0.5,0.0,0.0,1.0,0.0,0,0,0,-1
814346489,"SKYBREEZE, INC. 401(K) PROFIT SHARING PLAN",Multi Employer,3.0,0.0,0.0,0.0,0.5,0.0,0.0,1.0,0.0,0,0,0,-1
994951212,ALMEZY VENTURES INC. RETIREMENT PLAN,Multi Employer,1.0,0.0,0.0,0.0,0.5,0.0,0.0,1.0,0.0,0,0,0,-1
582121727,MANUEL COLON GARCIA DE LA NOCEDA RETIREMENT PLAN,Multi Employer,1.0,0.0,0.0,0.0,0.5,0.0,0.0,1.0,0.0,0,0,0,-1
814827624,OISHII WELFARE BENEFIT PLAN,Multi Employer,198.0,0.0,0.0,0.0,0.5,0.0,0.0,1.0,0.0,0,0,0,-1
464439683,"SPARKLE CITY LAUNDROMAT, INC. RETIREMENT PLAN",Multi Employer,4.0,0.0,0.0,0.0,0.5,0.0,0.0,1.0,0.0,0,0,0,-1
334646477,IOK PARTNERS INC 401(K) PLAN,Multi Employer,2.0,0.0,0.0,0.0,0.5,0.0,0.0,1.0,0.0,0,0,0,-1
270432198,GCGU INC. PROFIT SHARING PLAN,Multi Employer,2.0,0.0,0.0,0.0,0.5,0.0,0.0,1.0,0.0,0,0,0,-1
861642480,"KOENIG HOLDINGS, INC. RETIREMENT PLAN",Multi Employer,2.0,0.0,0.0,0.0,0.5,0.0,0.0,1.0,0.0,0,0,0,-1
465230603,MAKE INC. RETIREMENT PLAN,Multi Employer,8.0,0.0,0.0,0.0,0.5,0.0,0.0,1.0,0.0,0,0,0,-1
883719974,CHICARELLI PRODUCTIONS INC. 401K PROFIT SHARING PLAN,Multi Employer,0.0,0.0,0.0,0.0,0.5,0.0,0.0,1.0,0.0,0,0,0,-1
611778735,MATCH POINT INC. RETIREMENT PLAN,Multi Employer,1.0,0.0,0.0,0.0,0.5,0.0,0.0,1.0,0.0,0,0,0,-1
264020955,RTW SERVICES RETIREMENT PLAN,Multi Employer,1.0,0.0,0.0,0.0,0.5,0.0,0.0,1.0,0.0,0,0,0,-1
332139573,PROXCESS RECRUITING INC. RETIREMENT PLAN,Multi Employer,2.0,0.0,0.0,0.0,0.5,0.0,0.0,1.0,0.0,0,0,0,-1
272026253,CEDAR HOUSE ON SOUND INC. RETIREMENT PLAN,Multi Employer,5.0,0.0,0.0,0.0,0.5,0.0,0.0,1.0,0.0,0,0,0,-1
901007938,DERMATOLOGY SOLUTIONS GROUP DENTAL PLAN,Multi Employer,192.0,0.0,0.0,0.0,0.5,0.0,0.0,1.0,0.0,0,0,0,-1
43028678,"BETTER COMMUNITY LIVING, INC. 401(K) PLAN",Multi Employer,286.0,2.0,7060.0,0.728328611898017,0.27951807228915665,21.0,0.0,1.0,1.0,0,7,1,0
200108244,"SPERIDIAN TECHNOLOGIES, LLC INSURED BENEFITS PLAN",Multi Employer,340.0,1.0,616942.0,1.0,0.983132530120482,11111.0,0.0,1.0,1.0,0,8,1,0
272182377,MAPACA CORP. PROFIT SHARING PLAN,Multi Employer,0.0,0.0,0.0,0.0,0.5,0.0,0.0,1.0,0.0,0,0,0,-1
843090009,JBW FITNESS INC. RETIREMENT PLAN,Multi Employer,0.0,0.0,0.0,0.0,0.5,0.0,0.0,1.0,0.0,0,0,0,-1
223773443,GIRLS ON THE RUN NEW JERSEY EAST INC 403(B) PLAN,Multi Employer,4.0,0.0,0.0,0.0,0.5,0.0,0.0,1.0,0.0,0,0,0,-1
953957124,"JEFFREY E. DONFELD, A PROFESSIONAL CORP. 401(K) PROFIT SHARING PLAN",Multi Employer,0.0,0.0,0.0,0.0,0.5,0.0,0.0,1.0,0.0,0,0,0,-1
352125376,ALLIED SOLUTIONS LLC GROUP BENEFIT PLAN,Multi Employer,1654.0,0.0,0.0,0.0,0.5,0.0,0.0,1.0,0.0,0,0,0,-1
50319644,MAHR INC. WELFARE WRAP PLAN,Multi Employer,146.0,0.0,0.0,0.0,0.5,0.0,0.0,1.0,0.0,0,0,0,-1
383341253,J. RETTENMAIER USA LP HEALTH AND WELFARE BENEFITS PLAN,Multi Employer,371.0,0.0,0.0,0.0,0.5,0.0,0.0,1.0,0.0,0,0,0,-1
753167181,"MARIA T. HOANG, DDS PC 401K",Multi Employer,3.0,0.0,0.0,0.0,0.5,0.0,0.0,1.0,0.0,0,0,0,-1
873149787,"PRODUCTO HOLDINGS, LLC",Multi Employer,135.0,0.0,0.0,0.0,0.5,0.0,0.0,1.0,0.0,0,0,0,-1
472238002,DOOR CONTROLS USA BENEFITS PLAN,Multi Employer,247.0,0.0,0.0,0.0,0.5,0.0,0.0,1.0,0.0,0,0,0,-1
882961674,"MAHANEY, A TECTA AMERICA COMPANY, LLC. EMPLOYEE MEDICAL PLAN",Multi Employer,115.0,0.0,0.0,0.0,0.5,0.0,0.0,1.0,0.0,0,0,0,-1
510304364,HEROUX CORP. GROUP HEALTH PLAN,Multi Employer,332.0,0.0,0.0,0.0,0.5,0.0,0.0,1.0,0.0,0,0,0,-1
362595957,"VOLVO SALES AND SERVICE, INC. GROUP HEALTH INSURANCE PLAN",Multi Employer,366.0,0.0,0.0,0.0,0.5,0.0,0.0,1.0,0.0,0,0,0,-1
263716252,PERFORMANCE POINT EMPLOYEE BENEFITS PLAN,Multi Employer,99.0,0.0,0.0,0.0,0.5,0.0,0.0,1.0,0.0,0,0,0,-1
825075082,COMIN 1ST DEVELOPMENT INC. RETIREMENT PLAN,Multi Employer,13.0,0.0,0.0,0.0,0.5,0.0,0.0,1.0,0.0,0,0,0,-1
821512790,MONT BELVIEU 401(K) PLAN,Multi Employer,0.0,1.0,9128.0,1.0,0.3156626506024096,11111111.0,0.0,1.0,1.0,0,7,1,0
592760678,RICHARD L WALER JR CPA PA PROFIT SHARING PLAN AND TRUST,Multi Employer,5.0,0.0,0.0,0.0,0.5,0.0,0.0,1.0,0.0,0,0,0,-1
472271996,"SIGNATURE STAFFING, LLC WRAP PLAN",Multi Employer,,0.0,0.0,0.0,0.5,0.0,0.0,1.0,0.0,0,0,0,-1
860137291,"LAMB CHEVROLET, INC. 401K PROFIT SHARING PLAN",Multi Employer,0.0,0.0,0.0,0.0,0.5,0.0,0.0,1.0,0.0,0,0,0,-1
863239504,DURNEY ENTERPRISES INCORPORATED 401(K) PROFIT SHARING PLAN,Multi Employer,0.0,0.0,0.0,0.0,0.5,0.0,0.0,1.0,0.0,0,0,0,-1
431201439,"MERAVIC, INC. EMPLOYEE STOCK OWNERSHIP PLAN",Multi Employer,0.0,0.0,0.0,0.0,0.5,0.0,0.0,1.0,0.0,0,0,0,-1
111992329,HYGRADE METAL MOULDING MANUFACTURING CORP. EMPLOYEE BENEFIT PLAN,Multi Employer,87.0,3.0,42749.0,0.744227935156378,0.6602409638554216,1.1212221131112212e+39,0.0,1.0,0.7481549167076685,0,6,1,0
202905208,"HB PERFORMANCE SYSTEMS, INC. HEALTH AND WELFARE BENEFIT PLAN",Multi Employer,160.0,0.0,0.0,0.0,0.5,0.0,0.0,1.0,0.0,0,0,0,-1
874538653,JENSEN MECHANICAL LLC DBA AUTOMOTIVE RESOURCES 401K PLAN,Multi Employer,6.0,0.0,0.0,0.0,0.5,0.0,0.0,1.0,0.0,0,0,0,-1
453329260,GKC INC. 401(K) PLAN,Multi Employer,5.0,0.0,0.0,0.0,0.5,0.0,0.0,1.0,0.0,0,0,0,-1
331098818,ROOTS TO WINGS THORNTON 401(K) RETIREMENT BENEFIT PLAN,Multi Employer,75.0,0.0,0.0,0.0,0.5,0.0,0.0,1.0,0.0,0,0,0,-1
820729131,SKYLINE SPORT AERO RETIREMENT PLAN,Multi Employer,2.0,0.0,0.0,0.0,0.5,0.0,0.0,1.0,0.0,0,0,0,-1
741233796,SOUTHWESTERN UNIVERSITY HEALTH AND LIFE INSURANCE PLAN,Multi Employer,287.0,0.0,0.0,0.0,0.5,0.0,0.0,1.0,0.0,0,0,0,-1
852783885,"MYSHOCK HOLDINGS, INC. 401K PROFIT SHARING PLAN",Multi Employer,4.0,0.0,0.0,0.0,0.5,0.0,0.0,1.0,0.0,0,0,0,-1
30305008,UPPER VALLEY SERVICES HEALTH AND WELFARE PLAN,Multi Employer,169.0,0.0,0.0,0.0,0.5,0.0,0.0,1.0,0.0,0,0,0,-1
384204502,"DUDLEY HOLDINGS, INC. 401K PROFIT SHARING PLAN",Multi Employer,1.0,0.0,0.0,0.0,0.5,0.0,0.0,1.0,0.0,0,0,0,-1
473173095,JIMMY O'S TOOL SLED RETIREMENT PLAN,Multi Employer,1.0,0.0,0.0,0.0,0.5,0.0,0.0,1.0,0.0,0,0,0,-1
912092866,CENTURY 21 A PROPERTY SHOPPE PROFIT SHARING PLAN,Multi Employer,4.0,0.0,0.0,0.0,0.5,0.0,0.0,1.0,0.0,0,0,0,-1
841476508,FOUR STAR DRYWALL EMPLOYEE BENEFITS PLAN,Multi Employer,38.0,0.0,0.0,0.0,0.5,0.0,0.0,1.0,0.0,0,0,0,-1
621657685,FINANCIAL CONSULTING GROUP 401(K) PROFIT SHARING PLAN,Multi Employer,3.0,0.0,0.0,0.0,0.5,0.0,0.0,1.0,0.0,0,0,0,-1
821739851,"PROVIDENCE SERVICES, INC. 401(K) PLAN",Multi Employer,2.0,0.0,0.0,0.0,0.5,0.0,0.0,1.0,0.0,0,0,0,-1
824161876,NOOR FAMILY DENTISTRY 401K PLAN,Multi Employer,6.0,0.0,0.0,0.0,0.5,0.0,0.0,1.0,0.0,0,0,0,-1
845039826,APISREGINA INC. RETIREMENT PLAN,Multi Employer,0.0,0.0,0.0,0.0,0.5,0.0,0.0,1.0,0.0,0,0,0,-1
205094703,"VICTORY THB SMALLCAP FUND, LLC",DFE,,3.0,218987.0,0.6552763406046934,0.9325301204819277,0.0,0.0,1.0,0.0,0,2,1,1
942837630,"STAR ELEVATOR, INC. 401(K) SAVINGS AND PROFIT SHARING PLAN",Multi Employer,78.0,0.0,0.0,0.0,0.5,0.0,0.0,1.0,0.0,0,0,0,-1
200991676,ILLINOIS CENTRAL SCHOOL BUS HEALTH AND WELFARE PLAN,Multi Employer,1769.0,0.0,0.0,0.0,0.5,0.0,0.0,1.0,0.0,0,0,0,-1
383836804,LEAN TECHNIQUES,Multi Employer,135.0,0.0,0.0,0.0,0.5,0.0,0.0,1.0,0.0,0,0,0,-1
832777164,FIRST BREW FM INC. RETIREMENT PLAN,Multi Employer,2.0,0.0,0.0,0.0,0.5,0.0,0.0,1.0,0.0,0,0,0,-1
332559539,"SARAH FARMS, LLC",Multi Employer,174.0,0.0,0.0,0.0,0.5,0.0,0.0,1.0,0.0,0,0,0,-1
770358223,DANIEL C. SALAS HARVESTING,Multi Employer,189.0,0.0,0.0,0.0,0.5,0.0,0.0,1.0,0.0,0,0,0,-1
562819731,"RMT CONTRACTING, INC",Multi Employer,313.0,0.0,0.0,0.0,0.5,0.0,0.0,1.0,0.0,0,0,0,-1
990304002,"LANDSCAPE HAWAII, INC. HEALTH AND WELFARE BENEFITS PLAN",Multi Employer,218.0,0.0,0.0,0.0,0.5,0.0,0.0,1.0,0.0,0,0,0,-1
454829877,AJD VENTURES INC. RETIREMENT PLAN,Multi Employer,29.0,0.0,0.0,0.0,0.5,0.0,0.0,1.0,0.0,0,0,0,-1
476485096,PROBUSALLISONWBERGY23T25,Multi Employer,6.0,0.0,0.0,0.0,0.5,0.0,0.0,1.0,0.0,0,0,0,-1
842041327,SUNCASTER POOL SERVICES INC. 401(K) PLAN,Multi Employer,5.0,0.0,0.0,0.0,0.5,0.0,0.0,1.0,0.0,0,0,0,-1
943270968,DIRECT LINE GLOBAL LLC 401K PLAN,Multi Employer,0.0,2.0,57350.0,0.645231037489102,0.7325301204819277,11111111111.0,0.0,0.5,1.0,0,4,1,0
382177580,BUIST ELECTRIC INC. WELFARE BENEFIT PLAN,Multi Employer,479.0,0.0,0.0,0.0,0.5,0.0,0.0,1.0,0.0,0,0,0,-1
333427715,GANTT LAND MANAGEMENT INCORPORATED 401(K) PLAN,Multi Employer,0.0,0.0,0.0,0.0,0.5,0.0,0.0,1.0,0.0,0,0,0,-1
471734153,3TC INC. RETIREMENT PLAN,Multi Employer,4.0,0.0,0.0,0.0,0.5,0.0,0.0,1.0,0.0,0,0,0,-1
832477963,"ECOBAT RESOURCES US, LLC DEFINED BENEFIT PENSION PLANS MASTER TRUST",DFE,,0.0,0.0,0.0,0.5,0.0,0.0,1.0,0.0,0,0,0,-1
990759137,4WARD PFALLS CORP. RETIREMENT PLAN,Multi Employer,1.0,0.0,0.0,0.0,0.5,0.0,0.0,1.0,0.0,0,0,0,-1
731325906,CHANDLER USA INC. FLEXIBLE BENEFIT PLAN,Multi Employer,249.0,0.0,0.0,0.0,0.5,0.0,0.0,1.0,0.0,0,0,0,-1
274666060,AMPIAN HR 401(K) SAVINGS PLAN,Multiple Employer,208.0,1.0,74302.0,1.0,0.7783132530120482,11.0,0.0,1.0,0.0,0,5,1,0
931743440,CEDAR CREEK DT INCORPORATED RETIREMENT PLAN,Multi Employer,2.0,0.0,0.0,0.0,0.5,0.0,0.0,1.0,0.0,0,0,0,-1
411995430,MICRO-MATICS INC. EMPLOYEE STOCK OWNERSHIP PLAN,Multi Employer,25.0,0.0,0.0,0.0,0.5,0.0,0.0,1.0,0.0,0,0,0,-1
350715530,TRINE UNIVERSITY HEALTH AND WELFARE PLAN,Multi Employer,213.0,0.0,0.0,0.0,0.5,0.0,0.0,1.0,0.0,0,0,0,-1
203488653,TARRAR UTILITY CONSULANTS ESOP,Multi Employer,20.0,0.0,0.0,0.0,0.5,0.0,0.0,1.0,0.0,0,0,0,-1
760451829,"THE MONROE VOS CONSULTING GROUP, INC. PROFIT SHARING PLAN",Multi Employer,4.0,0.0,0.0,0.0,0.5,0.0,0.0,1.0,0.0,0,0,0,-1
201963214,PAILLES INVESTMENTS DEFINED BENEFIT PENSION PLAN,Multi Employer,2.0,0.0,0.0,0.0,0.5,0.0,0.0,1.0,0.0,0,0,0,-1
822883219,FLORABEL OLIVER-BADILLO DMD INC 401K PROFIT SHARING PLAN,Multi Employer,5.0,0.0,0.0,0.0,0.5,0.0,0.0,1.0,0.0,0,0,0,-1
300027777,PROBUSBUTLERY18T22,Multiple Employer,4.0,0.0,0.0,0.0,0.5,0.0,0.0,1.0,0.0,0,0,0,-1
472748692,"THE SAND CLUB ACADEMY, INC. 401(K) PLAN",Multi Employer,2.0,0.0,0.0,0.0,0.5,0.0,0.0,1.0,0.0,0,0,0,-1
330509446,STEPHEN DEMAINE C.P.A. PROFIT SHARING PLAN,Multi Employer,1.0,0.0,0.0,0.0,0.5,0.0,0.0,1.0,0.0,0,0,0,-1
201525990,CHARTER HOUSE HOLDINGS LLC EMPLOYEE BENEFITS PLAN,Multi Employer,0.0,0.0,0.0,0.0,0.5,0.0,0.0,1.0,0.0,0,0,0,-1
832392444,CANYON CREEK AGENCY RETIREMENT PLAN,Multi Employer,6.0,0.0,0.0,0.0,0.5,0.0,0.0,1.0,0.0,0,0,0,-1
834584820,YOTTER MANUFACTURING SERVICES COMPANY RETIREMENT PLAN,Multi Employer,7.0,0.0,0.0,0.0,0.5,0.0,0.0,1.0,0.0,0,0,0,-1
208087756,"AUDUBON ENGINEERING COMPANY, L.L.C. FIELD SERVICES 401(K) PLAN",Multi Employer,0.0,0.0,0.0,0.0,0.5,0.0,0.0,1.0,0.0,0,0,0,-1
474931807,"JLD SERVICES, INC. RETIREMENT PLAN",Multi Employer,5.0,0.0,0.0,0.0,0.5,0.0,0.0,1.0,0.0,0,0,0,-1
581132546,"CHATHAM ORTHOPAEDIC ASSOCIATES, P.A. WELFARE BENEFITS PLAN",Multi Employer,168.0,0.0,0.0,0.0,0.5,0.0,0.0,1.0,0.0,0,0,0,-1
584590814,ML BURGOS-MARTINEZ RETIREMENT PLAN,Multi Employer,1.0,0.0,0.0,0.0,0.5,0.0,0.0,1.0,0.0,0,0,0,-1
582957825,JG PAGAN FERNANDEZ RETIREMENT PLAN,Multi Employer,1.0,0.0,0.0,0.0,0.5,0.0,0.0,1.0,0.0,0,0,0,-1
660454038,S. LOPEZ MARTIN RETIREMENT PLAN,Multi Employer,1.0,0.0,0.0,0.0,0.5,0.0,0.0,1.0,0.0,0,0,0,-1
597078166,JA ORTIZ-RODRIGUEZ RETIREMENT PLAN,Multi Employer,1.0,0.0,0.0,0.0,0.5,0.0,0.0,1.0,0.0,0,0,0,-1
596243322,IC HERNANDEZ DIAZ RETIREMENT PLAN,Multi Employer,1.0,0.0,0.0,0.0,0.5,0.0,0.0,1.0,0.0,0,0,0,-1
583597801,CF GONZALEZ-RODRIGUEZ RETIREMENT PLAN,Multi Employer,1.0,0.0,0.0,0.0,0.5,0.0,0.0,1.0,0.0,0,0,0,-1
666052386,Y. MENDOZA GONZALEZ RETIREMENT PLAN,Multi Employer,1.0,0.0,0.0,0.0,0.5,0.0,0.0,1.0,0.0,0,0,0,-1
581533245,AM RODRIGUEZ-SANABRIA RETIREMENT PLAN,Multi Employer,1.0,0.0,0.0,0.0,0.5,0.0,0.0,1.0,0.0,0,0,0,-1
860101004,AFCU WELFARE BENEFIT PLAN,Multi Employer,658.0,0.0,0.0,0.0,0.5,0.0,0.0,1.0,0.0,0,0,0,-1
333113245,EDWARD MAE INCORPORATED PROFIT SHARING PLAN,Multi Employer,1.0,0.0,0.0,0.0,0.5,0.0,0.0,1.0,0.0,0,0,0,-1
450283814,ACME TOOLS SECTION 125 FLEXIBLE BENEFITS PLAN,Multi Employer,138.0,0.0,0.0,0.0,0.5,0.0,0.0,1.0,0.0,0,0,0,-1
472325603,SMF INNOVATIONS RETIREMENT PLAN,Multi Employer,1.0,0.0,0.0,0.0,0.5,0.0,0.0,1.0,0.0,0,0,0,-1
383066007,"VIASTORE SYSTEMS, INC. BENEFIT PLAN",Multi Employer,0.0,0.0,0.0,0.0,0.5,0.0,0.0,1.0,0.0,0,0,0,-1
991285121,JEMS QUALITY INC. 401K PROFIT SHARING PLAN,Multi Employer,0.0,0.0,0.0,0.0,0.5,0.0,0.0,1.0,0.0,0,0,0,-1
454291847,"QUINN MANAGEMENT GROUP, INC. 401K PROFIT SHARING PLAN",Multi Employer,0.0,0.0,0.0,0.0,0.5,0.0,0.0,1.0,0.0,0,0,0,-1
640606241,COMMUNITY BANCSHARES OF MISSISSIPPI CAFETERIA PLAN,Multi Employer,118.0,0.0,0.0,0.0,0.5,0.0,0.0,1.0,0.0,0,0,0,-1
666047620,NELSON ORTIZ SANTIAGO RETIREMENT PLAN,Multi Employer,1.0,0.0,0.0,0.0,0.5,0.0,0.0,1.0,0.0,0,0,0,-1
844008886,"PAKADARPANA FOODS, INC 401K PROFIT SHARING PLAN",Multi Employer,0.0,0.0,0.0,0.0,0.5,0.0,0.0,1.0,0.0,0,0,0,-1
850247111,"MENTAL HEALTH RESOURCES, INC.",Multi Employer,46.0,2.0,64882.0,0.5400573348540427,0.7542168674698795,11111.0,0.0,1.0,0.4599426651459573,0,3,1,1
814240052,"MCG I, INCORPORATED 401(K) PLAN",Multi Employer,0.0,0.0,0.0,0.0,0.5,0.0,0.0,1.0,0.0,0,0,0,-1
842821836,APEX ALL-SPORT RETIREMENT PLAN,Multi Employer,2.0,0.0,0.0,0.0,0.5,0.0,0.0,1.0,0.0,0,0,0,-1
752859772,"ODYSSEY INFORMATION SERVICES, INC. WELFARE BENEFIT",Multi Employer,227.0,0.0,0.0,0.0,0.5,0.0,0.0,1.0,0.0,0,0,0,-1
921463899,ANA FAMILY PHARMACY RETIREMENT PLAN,Multi Employer,2.0,0.0,0.0,0.0,0.5,0.0,0.0,1.0,0.0,0,0,0,-1
883799838,CHHOUN ENTERPRISE RETIREMENT PLAN,Multi Employer,2.0,0.0,0.0,0.0,0.5,0.0,0.0,1.0,0.0,0,0,0,-1
815104950,DDR SHERIDAN CORP. RETIREMENT PLAN,Multi Employer,4.0,0.0,0.0,0.0,0.5,0.0,0.0,1.0,0.0,0,0,0,-1
850969426,"HILLPOST HOLDINGS, INC. 401(K) PLAN",Multi Employer,3.0,0.0,0.0,0.0,0.5,0.0,0.0,1.0,0.0,0,0,0,-1
812690245,GERM BUSTERS INC. RETIREMENT PLAN,Multi Employer,9.0,0.0,0.0,0.0,0.5,0.0,0.0,1.0,0.0,0,0,0,-1
582436659,FRAN RETIREMENT PLAN,Multi Employer,1.0,0.0,0.0,0.0,0.5,0.0,0.0,1.0,0.0,0,0,0,-1
812480497,FIVE DOG ENTERPRISES INC 401(K) PLAN,Multi Employer,6.0,0.0,0.0,0.0,0.5,0.0,0.0,1.0,0.0,0,0,0,-1
421457548,THE KRELL INSTITUTE RETIREMENT PLAN,Multi Employer,16.0,0.0,0.0,0.0,0.5,0.0,0.0,1.0,0.0,0,0,0,-1
599147465,DR. YANIRIS GARCIA CRUZ RETIREMENT PLAN,Multi Employer,1.0,0.0,0.0,0.0,0.5,0.0,0.0,1.0,0.0,0,0,0,-1
455016960,MAIN STREET RENEWAL LLC CAFETERIA PLAN,Multi Employer,0.0,0.0,0.0,0.0,0.5,0.0,0.0,1.0,0.0,0,0,0,-1
300022045,"ADVICS NORTH AMERICA, INC. FLEXIBLE SPENDING BENEFITS PLAN",Multi Employer,221.0,0.0,0.0,0.0,0.5,0.0,0.0,1.0,0.0,0,0,0,-1
872924412,INMR ENTERPRISE CORP. RETIREMENT PLAN,Multi Employer,0.0,0.0,0.0,0.0,0.5,0.0,0.0,1.0,0.0,0,0,0,-1
872683980,"RYMART VENTURES, INC. 401K PROFIT SHARING PLAN",Multi Employer,0.0,0.0,0.0,0.0,0.5,0.0,0.0,1.0,0.0,0,0,0,-1
941711855,DISCO LIFE AND ACCIDENTAL DEATH & DISMEMBERMENT PLAN,Multi Employer,115.0,0.0,0.0,0.0,0.5,0.0,0.0,1.0,0.0,0,0,0,-1
853943411,"DALMATZ, INC. 401(K) PROFIT SHARING PLAN",Multi Employer,0.0,0.0,0.0,0.0,0.5,0.0,0.0,1.0,0.0,0,0,0,-1
